,,,,,,,Text,Contains_Relation
"""We find that the lift in gross margins was associated with an increase in quantity sold and a decrease in price per unit sold, and that the lift primarily came from low-shelf life product categories.""",,,,,,,"""We find that the lift in gross margins was associated with an increase in quantity sold and a decrease in price per unit sold, and that the lift primarily came from low-shelf life product categories.""",1
"""Surprisingly, subjects are more trusting and trustworthy when the stake size increases.""",,,,,,,"""Surprisingly, subjects are more trusting and trustworthy when the stake size increases.""",1
"""Although we observe that privacy regulation alone can result in a decrease in planning and operational HIEs, we also find that, when coupled with incentives, privacy regulation with requirements for patient consent can actually positively impact the development of HIE efforts.""",,,,,,,"""Although we observe that privacy regulation alone can result in a decrease in planning and operational HIEs, we also find that, when coupled with incentives, privacy regulation with requirements for patient consent can actually positively impact the development of HIE efforts.""",1
"""Using local land supply elasticities as an instrument for local real-estate prices, I estimate that a one-standard-deviation increase in collateral value causes bank debt as a fraction of total debt to increase by six percentage points.""",,,,,,,"""Using local land supply elasticities as an instrument for local real-estate prices, I estimate that a one-standard-deviation increase in collateral value causes bank debt as a fraction of total debt to increase by six percentage points.""",1
"""We find that television advertising for financial services brands increases both the number of related Google searches and searchers' tendency to use branded keywords in place of generic keywords.""",,,,,,,"""We find that television advertising for financial services brands increases both the number of related Google searches and searchers' tendency to use branded keywords in place of generic keywords.""",1
"""The insight for management: Forced distribution evaluation improves effort but may also increase destructive competition between employees.""",,,,,,,"""The insight for management: Forced distribution evaluation improves effort but may also increase destructive competition between employees.""",1
"""Once the market capacity becomes publicly known, each player must decide privately whether to enter the market and receive a payoff, which increases linearly in the difference between the market capacity and the number of entrants, or stay out.""",,,,,,,"""Once the market capacity becomes publicly known, each player must decide privately whether to enter the market and receive a payoff, which increases linearly in the difference between the market capacity and the number of entrants, or stay out.""",1
"""Managerial judgment is frequently required to estimate many of the parameters of decision calculus models and the quality of these judgmental inputs may substantially affect model-based decisions.""",,,,,,,"""Managerial judgment is frequently required to estimate many of the parameters of decision calculus models and the quality of these judgmental inputs may substantially affect model-based decisions.""",1
"""Do hospitals experience safety tipping points as utilization increases, and if so, what are the implications for hospital operations management?""",,,,,,,"""Do hospitals experience safety tipping points as utilization increases, and if so, what are the implications for hospital operations management?""",1
"""The price of a new product strictly increases with its quality and consumers' rational expectation about the time until the next new product will be introduced. ‚ú""",,,,,,,"""The price of a new product strictly increases with its quality and consumers' rational expectation about the time until the next new product will be introduced. ‚ú""",1
"""We also show that traffic and ownership may increase as the ownership cost increases and that a revenue-maximizing platform might prefer a situation in which cars are driven with only a few seats occupied, causing high traffic.""",,,,,,,"""We also show that traffic and ownership may increase as the ownership cost increases and that a revenue-maximizing platform might prefer a situation in which cars are driven with only a few seats occupied, causing high traffic.""",1
"""The problem is complicated by the fact that staffing level in one time period can affect the service levels in subsequent periods.""",,,,,,,"""The problem is complicated by the fact that staffing level in one time period can affect the service levels in subsequent periods.""",1
"""Moreover, this behavior increases when requests and bonuses are allowed.""",,,,,,,"""Moreover, this behavior increases when requests and bonuses are allowed.""",1
"""These additional price changes were mostly price decreases, and they were dispersed in time.""",,,,,,,"""These additional price changes were mostly price decreases, and they were dispersed in time.""",1
"""The decrease subsequently reverses in the following first fiscal quarter.""",,,,,,,"""The decrease subsequently reverses in the following first fiscal quarter.""",1
"""CCS capabilities effectively put an upper bound on the increase in electricity prices resulting from carbon regulations, and we estimate this bound to be near 30% at the retail level for both coal and natural gas plants.""",,,,,,,"""CCS capabilities effectively put an upper bound on the increase in electricity prices resulting from carbon regulations, and we estimate this bound to be near 30% at the retail level for both coal and natural gas plants.""",1
"""We also examine how the proximity to a brand‚ôs city of origin, the assortment share of a store‚ôs private label, the extent of retail competition, and the demographics of the store‚ôs neighborhood affect the purchase share‚ôs sensitivity to the point-of-sale marketing mix, revealing several subtl effects."" ",,,,,,,"""We also examine how the proximity to a brand‚ôs city of origin, the assortment share of a store‚ôs private label, the extent of retail competition, and the demographics of the store‚ôs neighborhood affect the purchase share‚ôs sensitivity to the point-of-sale marketing mix, revealing several subtl effects."" ",1
"""In each version of the model, an important function of the parameters, called the competitive advantage ratio, indicates when it is optimal to either increase or decrease effort allocated in a market in response to changes in various measures of effectiveness.""",,,,,,,"""In each version of the model, an important function of the parameters, called the competitive advantage ratio, indicates when it is optimal to either increase or decrease effort allocated in a market in response to changes in various measures of effectiveness.""",1
"""We find that an average TV ad leads to a 3% increase in EDGAR (Electronic Data Gathering, Analysis, and Retrieval) system queries and an 8% increase in Google searches for financial information within 15 minutes of the airing of that ad.""",,,,,,,"""We find that an average TV ad leads to a 3% increase in EDGAR (Electronic Data Gathering, Analysis, and Retrieval) system queries and an 8% increase in Google searches for financial information within 15 minutes of the airing of that ad.""",1
"""We build a game-theoretic model to examine how better demand forecasting resulting from algorithms, machine learning, and artificial intelligence affects the sustainability of collusion in an industry.""",,,,,,,"""We build a game-theoretic model to examine how better demand forecasting resulting from algorithms, machine learning, and artificial intelligence affects the sustainability of collusion in an industry.""",1
"""This search interval should shrink as congestion intensifies and as the number of performed tests increases if additional conditions hold.""",,,,,,,"""This search interval should shrink as congestion intensifies and as the number of performed tests increases if additional conditions hold.""",1
"""We show that when the cost increases as a linear or convex function of the package size, the firm should make packages of the smallest possible size.""",,,,,,,"""We show that when the cost increases as a linear or convex function of the package size, the firm should make packages of the smallest possible size.""",1
"""Such information asymmetry causes the manufacturer to incur a hidden information cost.""",,,,,,,"""Such information asymmetry causes the manufacturer to incur a hidden information cost.""",1
"""In my opinion the consequences would be a great increase in the value of operational research.""",,,,,,,"""In my opinion the consequences would be a great increase in the value of operational research.""",1
"""The purpose of this article is to formulate and test a decision model to increase the return on a pool of liquid assets through the use of Treasury bill futures contracts.""",,,,,,,"""The purpose of this article is to formulate and test a decision model to increase the return on a pool of liquid assets through the use of Treasury bill futures contracts.""",1
"""Second, reducing the variability of demand by pooling capacity in hospital clusters can greatly increase safety in a hospital system, because it reduces the likelihood that a patient will experience occupancy levels beyond the tipping point.""",,,,,,,"""Second, reducing the variability of demand by pooling capacity in hospital clusters can greatly increase safety in a hospital system, because it reduces the likelihood that a patient will experience occupancy levels beyond the tipping point.""",1
"""In this paper, we take a broader approach to the issue, combining a ‚úproductivity‚ù and an ‚úadoption‚ù approach, while including a search for contextual variables in the firm‚ôs strategy that affects complementarity.""",,,,,,,"""In this paper, we take a broader approach to the issue, combining a ‚úproductivity‚ù and an ‚úadoption‚ù approach, while including a search for contextual variables in the firm‚ôs strategy that affects complementarity.""",1
"""A unit increase in training is linked to a 2.14% increase in an employee's performance.""",,,,,,,"""A unit increase in training is linked to a 2.14% increase in an employee's performance.""",1
"""First, retailers‚ô orders increase as the number of retailers decreases or the supplier‚ôs production capacity shrinks.""",,,,,,,"""First, retailers‚ô orders increase as the number of retailers decreases or the supplier‚ôs production capacity shrinks.""",1
"""Consequently, despite what customers may think about the availability verification, it actually increases their surplus.""",,,,,,,"""Consequently, despite what customers may think about the availability verification, it actually increases their surplus.""",1
"""Yet little empirical research has examined how reference groups affect the product line decisions of firms.""",,,,,,,"""Yet little empirical research has examined how reference groups affect the product line decisions of firms.""",1
"""The choice of performance information system did affect the task processes, the choice of structure, and the involvement in task supporting processes.""",,,,,,,"""The choice of performance information system did affect the task processes, the choice of structure, and the involvement in task supporting processes.""",1
"""A setting in which customer-owned mutual companies converted to publicly listed firms created a plausibly exogenous increase in stock ownership.""",,,,,,,"""A setting in which customer-owned mutual companies converted to publicly listed firms created a plausibly exogenous increase in stock ownership.""",1
"""These changes in behavior are not associated with short-run increases in customer profitability, but customers who adopt online banking have a lower propensity to leave the bank.""",,,,,,,"""These changes in behavior are not associated with short-run increases in customer profitability, but customers who adopt online banking have a lower propensity to leave the bank.""",1
"""Using a large sample of albums from all four major record labels, I find that removing DRM increases digital music sales by 10%, but relaxing sharing restrictions does not impact all albums equally.""",,,,,,,"""Using a large sample of albums from all four major record labels, I find that removing DRM increases digital music sales by 10%, but relaxing sharing restrictions does not impact all albums equally.""",1
"""In addition, subjects overestimate the performance of the merged firm and attribute the decrease in performance to members of the other firm rather than to situational difficulties created by conflicting culture.""",,,,,,,"""In addition, subjects overestimate the performance of the merged firm and attribute the decrease in performance to members of the other firm rather than to situational difficulties created by conflicting culture.""",1
"""This, in turn, implies that even a small advantage in customer loyalty may lead to a large increase in profits and may help explain why some managers place such a high value on earning customer loyalty.""",,,,,,,"""This, in turn, implies that even a small advantage in customer loyalty may lead to a large increase in profits and may help explain why some managers place such a high value on earning customer loyalty.""",1
"""Further, star articles increase these rates significantly more than other top 112 university scientists' articles.""",,,,,,,"""Further, star articles increase these rates significantly more than other top 112 university scientists' articles.""",1
"""More specifically, the error rate of operational risk events decreases first, as workload increases, and then increases.""",,,,,,,"""More specifically, the error rate of operational risk events decreases first, as workload increases, and then increases.""",1
"""As observed by simulation experiments, it turns out that for these robust versions the variability compared to their classical counterparts is considerably reduced with a negligible decrease in average revenue.""",,,,,,,"""As observed by simulation experiments, it turns out that for these robust versions the variability compared to their classical counterparts is considerably reduced with a negligible decrease in average revenue.""",1
"""Discounts increase when the sale is urgent, market conditions are poor, and the seller is financially constrained.""",,,,,,,"""Discounts increase when the sale is urgent, market conditions are poor, and the seller is financially constrained.""",1
"""The question of the empirical application of the indicators of the hierarchical dimensions in turn leads to a consideration of the problems of index construction, analysis of change over time, analysis of causes and consequences of variation in degree of organizational hierarchy, and of comparative research, whether cross-national, cross-organizational, or experimental in character.""",,,,,,,"""The question of the empirical application of the indicators of the hierarchical dimensions in turn leads to a consideration of the problems of index construction, analysis of change over time, analysis of causes and consequences of variation in degree of organizational hierarchy, and of comparative research, whether cross-national, cross-organizational, or experimental in character.""",1
"""Second, as the potential substitutability between products increases due to social influence, the firm may leverage the increased substitutability and enjoy lower cost in production by reducing product assortment before demand realization.""",,,,,,,"""Second, as the potential substitutability between products increases due to social influence, the firm may leverage the increased substitutability and enjoy lower cost in production by reducing product assortment before demand realization.""",1
"""Using unique nursing home IT data from 2006 to 2012, we find that the licensed nurse staffing level decreases by 5.8% in high-end nursing homes but increases by 7.6% in low-end homes after the adoption of automation technology.""",,,,,,,"""Using unique nursing home IT data from 2006 to 2012, we find that the licensed nurse staffing level decreases by 5.8% in high-end nursing homes but increases by 7.6% in low-end homes after the adoption of automation technology.""",1
"""Financial constraints can cause firms to reduce product quality when quality is difficult to observe.""",,,,,,,"""Financial constraints can cause firms to reduce product quality when quality is difficult to observe.""",1
"""The analysis reveals differences in how various parameters affect the cost reduction from pooling and suggests that these differences stem from the manner in which the parameters influence the induced correlation between lead-time demands of the demand streams.""",,,,,,,"""The analysis reveals differences in how various parameters affect the cost reduction from pooling and suggests that these differences stem from the manner in which the parameters influence the induced correlation between lead-time demands of the demand streams.""",1
"""Monitoring does not affect theft, with 10% of participants stealing overall.""",,,,,,,"""Monitoring does not affect theft, with 10% of participants stealing overall.""",1
"""We use counterfactuals to show a nuanced impact of left-digit bias, which can both increase and decrease the payments.""",,,,,,,"""We use counterfactuals to show a nuanced impact of left-digit bias, which can both increase and decrease the payments.""",1
"""Our numerical experiments suggest that extracting failed leads only when forced to because of space limitations is usually a good rule of thumb, but that following the optimal policy, as opposed to the commonly used heuristic policies, can extend an average patient‚ôs expected lifetime by up to 1.2 years and decrease the likelihood of device-related death by up to 94% in some cases.""",,,,,,,"""Our numerical experiments suggest that extracting failed leads only when forced to because of space limitations is usually a good rule of thumb, but that following the optimal policy, as opposed to the commonly used heuristic policies, can extend an average patient‚ôs expected lifetime by up to 1.2 years and decrease the likelihood of device-related death by up to 94% in some cases.""",1
"""Significantly outperforming (underperforming) managers are less (more) likely to be fired in the future and are also more likely to increase relative risk.""",,,,,,,"""Significantly outperforming (underperforming) managers are less (more) likely to be fired in the future and are also more likely to increase relative risk.""",1
"""Third, consumers‚ô ex ante valuation uncertainty may increase or decrease firm profits without BPD, and it weakly increases firm profits with BPD, relative to the inspection good duopoly.""",,,,,,,"""Third, consumers‚ô ex ante valuation uncertainty may increase or decrease firm profits without BPD, and it weakly increases firm profits with BPD, relative to the inspection good duopoly.""",1
"""However, the hypothesis that an increase in perceived environmental uncertainty prompts the principal to award compensation contracts of smaller total expected value and a smaller proportion of performance-contingent pay was rejected.""",,,,,,,"""However, the hypothesis that an increase in perceived environmental uncertainty prompts the principal to award compensation contracts of smaller total expected value and a smaller proportion of performance-contingent pay was rejected.""",1
"""The n most vital nodes in a network are those n nodes whose removal, along with all arcs incident with them, would cause the greatest decrease in maximum flow between a specified node pair.""",,,,,,,"""The n most vital nodes in a network are those n nodes whose removal, along with all arcs incident with them, would cause the greatest decrease in maximum flow between a specified node pair.""",1
"""Our main focus is on how the presence of the multiplicative background risk ·ªπ affects risk-taking behavior for decisions on the choice of xÃÉ. We extend the results of Gollier and Pratt (1996) to characterize conditions on preferences that lead to more cautious behavior.""",,,,,,,"""Our main focus is on how the presence of the multiplicative background risk ·ªπ affects risk-taking behavior for decisions on the choice of xÃÉ. We extend the results of Gollier and Pratt (1996) to characterize conditions on preferences that lead to more cautious behavior.""",1
"""However, in the third product category we find mild evidence of time-varying dynamics, where search decreases over time from already low levels.""",,,,,,,"""However, in the third product category we find mild evidence of time-varying dynamics, where search decreases over time from already low levels.""",1
"""For example, if the bidder and target operate in independent markets, the bidder has flexible production facilities but the target's production facilities are inflexible, then an increase in the bidder's demand can make the target less attractive and lower the value of operational synergy.""",,,,,,,"""For example, if the bidder and target operate in independent markets, the bidder has flexible production facilities but the target's production facilities are inflexible, then an increase in the bidder's demand can make the target less attractive and lower the value of operational synergy.""",1
"""Our analysis suggests that uncertainty regarding reporting weakness affects both the level of the market-to-book ratio and its association with firm size.""",,,,,,,"""Our analysis suggests that uncertainty regarding reporting weakness affects both the level of the market-to-book ratio and its association with firm size.""",1
"""Knowledge Recombination Across Technological Boundaries: Scientists vs. Engineers (p. 837)Marc Gruber, Dietmar Harhoff, Karin HoislHow do individual-level characteristics of inventors affect the breadth of their recombination of different technologies to generate radical innovations?""",,,,,,,"""Knowledge Recombination Across Technological Boundaries: Scientists vs. Engineers (p. 837)Marc Gruber, Dietmar Harhoff, Karin HoislHow do individual-level characteristics of inventors affect the breadth of their recombination of different technologies to generate radical innovations?""",1
"""Debt financing increases incentives to exit, which, although costly for the firm, is socially beneficial.""",,,,,,,"""Debt financing increases incentives to exit, which, although costly for the firm, is socially beneficial.""",1
"""Thus, when food energy intake decreases, the activity pattern of an individual as represented by a queueing system changes: more time is spent at rest; less time is spent in moving activities.""",,,,,,,"""Thus, when food energy intake decreases, the activity pattern of an individual as represented by a queueing system changes: more time is spent at rest; less time is spent in moving activities.""",1
"""This growth was driven primarily by an increase in functional managers rather than general managers, a phenomenon we term ‚úfunctional centralization.‚ù""",,,,,,,"""This growth was driven primarily by an increase in functional managers rather than general managers, a phenomenon we term ‚úfunctional centralization.‚ù""",1
"""An increase of one standard deviation in EPU is associated with a 1.5% increase in forecasted three-month abnormal returns (6.1% annualized).""",,,,,,,"""An increase of one standard deviation in EPU is associated with a 1.5% increase in forecasted three-month abnormal returns (6.1% annualized).""",1
"""We show in this reply that the response by Charnes and Cooper to our paper is aimed at an issue that is only tangential to our analysis and does not affect our conclusions.""",,,,,,,"""We show in this reply that the response by Charnes and Cooper to our paper is aimed at an issue that is only tangential to our analysis and does not affect our conclusions.""",1
"""In particular, the (expected) channel profit loss, compared with that of a centralized system, increases with demand price elasticity and decreases with retailer's cost share, while the profit share extracted by the retailer decreases with price elasticity and increases with retailer's cost share.""",,,,,,,"""In particular, the (expected) channel profit loss, compared with that of a centralized system, increases with demand price elasticity and decreases with retailer's cost share, while the profit share extracted by the retailer decreases with price elasticity and increases with retailer's cost share.""",1
"""We determine the optimal dynamic sampling effort of a firm and examine the factors that affect the sampling decision.""",,,,,,,"""We determine the optimal dynamic sampling effort of a firm and examine the factors that affect the sampling decision.""",1
"""Combinatorial auctions‚îin which bidders can bid on combinations of goods‚îcan increase the economic efficiency of a trade when goods have complementarities.""",,,,,,,"""Combinatorial auctions‚îin which bidders can bid on combinations of goods‚îcan increase the economic efficiency of a trade when goods have complementarities.""",1
"""While perceived expertise did not increase the individual's emphasis of their own unique knowledge, perceived experts were more likely than nonexperts to emphasize shared knowledge and other member's unique knowledge contributions.""",,,,,,,"""While perceived expertise did not increase the individual's emphasis of their own unique knowledge, perceived experts were more likely than nonexperts to emphasize shared knowledge and other member's unique knowledge contributions.""",1
