,,,,,,,Text,Contains_Relation
"""We find that callers experience three to six times less discomfort per unit of time while waiting for callbacks than while waiting in queue, suggesting that offering callbacks can increase service quality by channeling callers to an alternative service channel where they experience less discomfort while waiting.""",,,,,,,"""We find that callers experience three to six times less discomfort per unit of time while waiting for callbacks than while waiting in queue, suggesting that offering callbacks can increase service quality by channeling callers to an alternative service channel where they experience less discomfort while waiting.""",1
"""Empirically, higher volatility of electricity prices leads to an increase in cash holdings, and this effect is robust to instrumenting for price risk using weather volatility.""",,,,,,,"""Empirically, higher volatility of electricity prices leads to an increase in cash holdings, and this effect is robust to instrumenting for price risk using weather volatility.""",1
"""I find that the mission, whether matched or random, increases effort compared to the no-mission condition.""",,,,,,,"""I find that the mission, whether matched or random, increases effort compared to the no-mission condition.""",1
"""This suggests that superstitious belief still affects economic activities.""",,,,,,,"""This suggests that superstitious belief still affects economic activities.""",1
"""The change in the sampling level is indeterminate because, while increased sampling productivity means that firms have incentives to increase sampling, the increase in the equilibrium goodwill level indirectly reduces the marginal productivity of sampling, thus reducing the incentives to sample.""",,,,,,,"""The change in the sampling level is indeterminate because, while increased sampling productivity means that firms have incentives to increase sampling, the increase in the equilibrium goodwill level indirectly reduces the marginal productivity of sampling, thus reducing the incentives to sample.""",1
"""The findings suggest that the risk of receiving stress-related medication increases significantly for employees at organizations that change, especially those that undergo broad simultaneous changes along several dimensions.""",,,,,,,"""The findings suggest that the risk of receiving stress-related medication increases significantly for employees at organizations that change, especially those that undergo broad simultaneous changes along several dimensions.""",1
"""Such campaigns often take the form of charity-linked promotions, whereby a firm donates a specific amount to a charitable cause when a customer takes up the promotion through a related purchase.""",,,,,,,"""Such campaigns often take the form of charity-linked promotions, whereby a firm donates a specific amount to a charitable cause when a customer takes up the promotion through a related purchase.""",1
"""Moderate turbulence reduces the value of flexibility by making supplier selection more difficult and increases the value of commitment by mitigating the status quo bias of integrated structures.""",,,,,,,"""Moderate turbulence reduces the value of flexibility by making supplier selection more difficult and increases the value of commitment by mitigating the status quo bias of integrated structures.""",1
"""Our results provide field-based evidence that PFP and participative goal setting affect the level and accuracy of goals, effects that are associated with both information exchange and with managers' incentives to influence goals.""",,,,,,,"""Our results provide field-based evidence that PFP and participative goal setting affect the level and accuracy of goals, effects that are associated with both information exchange and with managers' incentives to influence goals.""",1
"""We study how monetary policy affects the funding composition of the banking sector.""",,,,,,,"""We study how monetary policy affects the funding composition of the banking sector.""",1
"""This paper identifies a number of obstacles to international generalizability, and shows how they affect technical systems research and social systems research in different ways.""",,,,,,,"""This paper identifies a number of obstacles to international generalizability, and shows how they affect technical systems research and social systems research in different ways.""",1
"""In comparison to the case where there is no social learning, we show that (i) when the uncertainty is relatively low, the firm opts for a product of inferior design accompanied by a lower price, while (ii) when the uncertainty is high, the firm chooses a product of superior design accompanied by a higher price; interestingly, we find that the product‚ôs expected quality decreases either in the absolute sense (in the former case), or relative to the product‚ôs price (in the latter case).""",,,,,,,"""In comparison to the case where there is no social learning, we show that (i) when the uncertainty is relatively low, the firm opts for a product of inferior design accompanied by a lower price, while (ii) when the uncertainty is high, the firm chooses a product of superior design accompanied by a higher price; interestingly, we find that the product‚ôs expected quality decreases either in the absolute sense (in the former case), or relative to the product‚ôs price (in the latter case).""",1
"""One explanation is that IS spending may lead to increases in product quality or variety which tend to be overlooked in the aggregate statistics, even if they increase output at the firm-level.""",,,,,,,"""One explanation is that IS spending may lead to increases in product quality or variety which tend to be overlooked in the aggregate statistics, even if they increase output at the firm-level.""",1
"""Whereas most of these characteristics predict proxy contests in time series, prior to proxy contests, targets also experience poor stock performance, decreases in investments, increases in cash reserves and payouts to shareholders, and increases in management‚ôs entrenchment.""",,,,,,,"""Whereas most of these characteristics predict proxy contests in time series, prior to proxy contests, targets also experience poor stock performance, decreases in investments, increases in cash reserves and payouts to shareholders, and increases in management‚ôs entrenchment.""",1
"""Instead, we provide evidence that expanding the menu of choices or making an agent aware of choices that she has been denied can affect how a contract is valued.""",,,,,,,"""Instead, we provide evidence that expanding the menu of choices or making an agent aware of choices that she has been denied can affect how a contract is valued.""",1
"""On the other hand, long production runs increase the average makespan (time to completion) of coils.""",,,,,,,"""On the other hand, long production runs increase the average makespan (time to completion) of coils.""",1
"""A natural idea, which should intuitively increase the provider‚ôs profit, is to sell these idle instances on a secondary market, for example, via a preemptible spot market.""",,,,,,,"""A natural idea, which should intuitively increase the provider‚ôs profit, is to sell these idle instances on a secondary market, for example, via a preemptible spot market.""",1
"""This is because contractually specified incentives inevitably have conflicting effects: they simultaneously increase the likelihood of welfare-improving investments and welfare-reducing opportunistic behavior.""",,,,,,,"""This is because contractually specified incentives inevitably have conflicting effects: they simultaneously increase the likelihood of welfare-improving investments and welfare-reducing opportunistic behavior.""",1
"""Our experiment results in an increase in loan repayments in the sample period.""",,,,,,,"""Our experiment results in an increase in loan repayments in the sample period.""",1
"""Using prior expectations about price and response time, we show how shopbots can substantially increase consumer utility by searching more intelligently and then selectively presenting offers.""",,,,,,,"""Using prior expectations about price and response time, we show how shopbots can substantially increase consumer utility by searching more intelligently and then selectively presenting offers.""",1
"""Consequently, the incentives for providers to improve service quality may disappear if providers upcode, i.e., misreport HAIs (possibly unintentionally) in a manner that increases reimbursement or avoids financial penalties.""",,,,,,,"""Consequently, the incentives for providers to improve service quality may disappear if providers upcode, i.e., misreport HAIs (possibly unintentionally) in a manner that increases reimbursement or avoids financial penalties.""",1
"""We also exploit a feature of structured finance that identifies rating shopping and find that incumbent ratings increase in shopping.""",,,,,,,"""We also exploit a feature of structured finance that identifies rating shopping and find that incumbent ratings increase in shopping.""",1
"""It extends some of Bellman's work in that the transformed states at successive stages may not have the properties demanded by Bellman; e.g., the state norm need not diminish at all, and can, in fact, increase.""",,,,,,,"""It extends some of Bellman's work in that the transformed states at successive stages may not have the properties demanded by Bellman; e.g., the state norm need not diminish at all, and can, in fact, increase.""",1
"""In particular, we find that, contrary to the conventional war of attrition where an increase in benefits for the follower generally delays the first move, an increase in the rate of learning‚îwhich tends to benefit the follower‚îcan hasten the first investment.""",,,,,,,"""In particular, we find that, contrary to the conventional war of attrition where an increase in benefits for the follower generally delays the first move, an increase in the rate of learning‚îwhich tends to benefit the follower‚îcan hasten the first investment.""",1
"""Results from six laboratory studies and a field experiment demonstrate that exposure to messages that praise customers for good deeds can increase subsequent self-interested and self-indulgent behaviors more than messages that publicize a company‚ôs good deeds or thank consumers for their patronage.""",,,,,,,"""Results from six laboratory studies and a field experiment demonstrate that exposure to messages that praise customers for good deeds can increase subsequent self-interested and self-indulgent behaviors more than messages that publicize a company‚ôs good deeds or thank consumers for their patronage.""",1
"""Furthermore, that increase is driven by both the operator and the service provider.""",,,,,,,"""Furthermore, that increase is driven by both the operator and the service provider.""",1
"""If consumers‚ô values to subsequent goods decrease quickly, we show by example that one should expect bundling to be suboptimal.""",,,,,,,"""If consumers‚ô values to subsequent goods decrease quickly, we show by example that one should expect bundling to be suboptimal.""",1
"""For example, the U.S. Government's policy of revealing losing bids may cause regret-sensitive bidders to anticipate regret and bid conservatively, decreasing the government's revenue.""",,,,,,,"""For example, the U.S. Government's policy of revealing losing bids may cause regret-sensitive bidders to anticipate regret and bid conservatively, decreasing the government's revenue.""",1
"""In the single-period problem, random capacity does not affect the optimal policy but results in a unimodal, nonconvex cost function.""",,,,,,,"""In the single-period problem, random capacity does not affect the optimal policy but results in a unimodal, nonconvex cost function.""",1
"""We find that ETF activity increases short-run informational efficiency for stocks with weak information environments.""",,,,,,,"""We find that ETF activity increases short-run informational efficiency for stocks with weak information environments.""",1
"""The model also predicts that sorting under asymmetric information causes the firm to turn away more candidates than would be efficient; PPS increases in the cost of hiring the manager and in the manager's outside option, but decreases in output risk, information risk, and managerial risk aversion; and the firm becomes more selective in hiring as either the manager's outside option, the cost of hiring, risk aversion, output risk, or information risk increases.""",,,,,,,"""The model also predicts that sorting under asymmetric information causes the firm to turn away more candidates than would be efficient; PPS increases in the cost of hiring the manager and in the manager's outside option, but decreases in output risk, information risk, and managerial risk aversion; and the firm becomes more selective in hiring as either the manager's outside option, the cost of hiring, risk aversion, output risk, or information risk increases.""",1
"""We find that both features of sponsorship significantly increase willingness to compete among men on average, while neither of these channels significantly increases willingness to compete among women on average.""",,,,,,,"""We find that both features of sponsorship significantly increase willingness to compete among men on average, while neither of these channels significantly increases willingness to compete among women on average.""",1
"""When manufacturers do not have sufficient capacity to meet demand and cannot increase prices, they have to determine other methods to allocate goods among retailers.""",,,,,,,"""When manufacturers do not have sufficient capacity to meet demand and cannot increase prices, they have to determine other methods to allocate goods among retailers.""",1
"""The relative accuracy of C-MSKF increases with decreasing length of historical time series data, increasing forecasting horizon, and sensitivity of school districts to the economic cycle.""",,,,,,,"""The relative accuracy of C-MSKF increases with decreasing length of historical time series data, increasing forecasting horizon, and sensitivity of school districts to the economic cycle.""",1
"""Each job to be processed incurs a loss which increases linearly with its waiting time.""",,,,,,,"""Each job to be processed incurs a loss which increases linearly with its waiting time.""",1
"""Furthermore, for ‚úvery high‚ù search levels, even the system profit (sum of manufacturer and retailer profits) may decrease upon centralization.""",,,,,,,"""Furthermore, for ‚úvery high‚ù search levels, even the system profit (sum of manufacturer and retailer profits) may decrease upon centralization.""",1
"""First, we find that both accommodating line-sitting and selling priority can bring in extra revenue for the service provider, although by different means‚îselling priority increases revenue mainly by allowing the service provider to practice price discrimination that extracts more customer surplus, whereas line-sitting does so through demand expansion, attracting customers who would not otherwise join.""",,,,,,,"""First, we find that both accommodating line-sitting and selling priority can bring in extra revenue for the service provider, although by different means‚îselling priority increases revenue mainly by allowing the service provider to practice price discrimination that extracts more customer surplus, whereas line-sitting does so through demand expansion, attracting customers who would not otherwise join.""",1
"""Computational results show that the best among the frequency-based direct shipping policies used to obtain the worst-case results gives an average percent increase error, with respect to a lower bound on the optimal cost of the problem in which routing is allowed, of 6.44% on a large set of randomly generated problem instances.""",,,,,,,"""Computational results show that the best among the frequency-based direct shipping policies used to obtain the worst-case results gives an average percent increase error, with respect to a lower bound on the optimal cost of the problem in which routing is allowed, of 6.44% on a large set of randomly generated problem instances.""",1
"""With a data set consisting of automobile sales transaction data from a major U.S. automaker, the authors find a 20% improvement in prediction accuracy over state-of-the-art benchmark models, which can result in a 10% increase in revenues from optimizing the offer set.""",,,,,,,"""With a data set consisting of automobile sales transaction data from a major U.S. automaker, the authors find a 20% improvement in prediction accuracy over state-of-the-art benchmark models, which can result in a 10% increase in revenues from optimizing the offer set.""",1
"""Counter-intuitive examples where reducing switchover time can increase WIP are also reported.""",,,,,,,"""Counter-intuitive examples where reducing switchover time can increase WIP are also reported.""",1
"""We also find that increased automation improves the ratings on clinical quality by 6.9% and decreases admissions of less profitable residents by 14.7% on average.""",,,,,,,"""We also find that increased automation improves the ratings on clinical quality by 6.9% and decreases admissions of less profitable residents by 14.7% on average.""",1
"""Consistent with the developed theory, shifting to a temporally frequent quota structure leads to an increase in sales performance for low-performing salespeople by preventing them from giving up in later periods within a quota-evaluation cycle, but to a decrease in sales performance for high-performing salespeople.""",,,,,,,"""Consistent with the developed theory, shifting to a temporally frequent quota structure leads to an increase in sales performance for low-performing salespeople by preventing them from giving up in later periods within a quota-evaluation cycle, but to a decrease in sales performance for high-performing salespeople.""",1
"""It is commonly held that the ‚úMatthew Effect‚ù dominates‚îwider distribution of rewards increases the overall welfare of the contest.""",,,,,,,"""It is commonly held that the ‚úMatthew Effect‚ù dominates‚îwider distribution of rewards increases the overall welfare of the contest.""",1
"""Prior work suggests that an increase in patient volume in a hospital service is associated with reduced costs per patient in that service.""",,,,,,,"""Prior work suggests that an increase in patient volume in a hospital service is associated with reduced costs per patient in that service.""",1
"""We find that the content submission significantly increases engagement and retention by reducing users‚ô hazard of ending a session by approximately 11% relative to the baseline and reducing the hazard of abandoning the game app by 14%.""",,,,,,,"""We find that the content submission significantly increases engagement and retention by reducing users‚ô hazard of ending a session by approximately 11% relative to the baseline and reducing the hazard of abandoning the game app by 14%.""",1
"""Although orginally developed to allocate budget increases, the model may be used in allocating budget cuts as well; this form of the model is also presented.""",,,,,,,"""Although orginally developed to allocate budget increases, the model may be used in allocating budget cuts as well; this form of the model is also presented.""",1
"""Finally, we examine the efficiency of these procedures and show that as the degree of common values increases, fewer mutually beneficial agreements are attained.""",,,,,,,"""Finally, we examine the efficiency of these procedures and show that as the degree of common values increases, fewer mutually beneficial agreements are attained.""",1
"""In this supply chain, a horizontal merger at any other tier will decrease consumer price when the cost reduction exceeds a certain threshold that is larger than the premerger markup.""",,,,,,,"""In this supply chain, a horizontal merger at any other tier will decrease consumer price when the cost reduction exceeds a certain threshold that is larger than the premerger markup.""",1
"""Overall, our experiments offer little evidence that gender composition affects expression of minority views.""",,,,,,,"""Overall, our experiments offer little evidence that gender composition affects expression of minority views.""",1
"""Results indicate good performance which deteriorates as the fill rate requirement and lead time increase.""",,,,,,,"""Results indicate good performance which deteriorates as the fill rate requirement and lead time increase.""",1
"""To increase revenue or improve customer service, companies are increasingly personalizing their product or service offerings based on their customers' history of interactions.""",,,,,,,"""To increase revenue or improve customer service, companies are increasingly personalizing their product or service offerings based on their customers' history of interactions.""",1
"""In this note, we point out that a similar formula holds if the requirements increase up to a certain value, then decrease.""",,,,,,,"""In this note, we point out that a similar formula holds if the requirements increase up to a certain value, then decrease.""",1
"""In a study of the global semiconductor industry, the authors find that, in addition to serving as a mechanism for sourcing knowledge, strong internal linkages help firms increase internalization and create higher levels of technological interdependence across firm locations.""",,,,,,,"""In a study of the global semiconductor industry, the authors find that, in addition to serving as a mechanism for sourcing knowledge, strong internal linkages help firms increase internalization and create higher levels of technological interdependence across firm locations.""",1
"""The cost of increasing production from one period to the next is a concave function of the increase; similarly, the cost of decreasing production is a concave function of the decrease.""",,,,,,,"""The cost of increasing production from one period to the next is a concave function of the increase; similarly, the cost of decreasing production is a concave function of the decrease.""",1
"""The resulting reduction in borrowing capacity affects significantly both investment and employment: for firms whose effective capital requirements increase by 1 percentage point, fixed assets are reduced by 1.1%, capital expenditures by 2.7%, and employment by 0.8%.""",,,,,,,"""The resulting reduction in borrowing capacity affects significantly both investment and employment: for firms whose effective capital requirements increase by 1 percentage point, fixed assets are reduced by 1.1%, capital expenditures by 2.7%, and employment by 0.8%.""",1
"""Effect of Information Feedback on Bidder Behavior in Continuous Combinatorial Auctions (p. 811)Gediminas Adomavicius, Shawn P. Curley, Alok Gupta, Pallab SanyalRecent theoretical advances have shown that combinatorial auctions‚îin which bidders can bid on combinations of goods, can increase the economic efficiency of a trade when goods have complementarities.""",,,,,,,"""Effect of Information Feedback on Bidder Behavior in Continuous Combinatorial Auctions (p. 811)Gediminas Adomavicius, Shawn P. Curley, Alok Gupta, Pallab SanyalRecent theoretical advances have shown that combinatorial auctions‚îin which bidders can bid on combinations of goods, can increase the economic efficiency of a trade when goods have complementarities.""",1
"""This underestimation stabilizes over time because negative consequences decrease the likelihood of choosing the law-of-effect strategy in the future.""",,,,,,,"""This underestimation stabilizes over time because negative consequences decrease the likelihood of choosing the law-of-effect strategy in the future.""",1
"""Clearly, what you search for is being used as information; advertisers use online customer data to target their marketing and increase its effectiveness.""",,,,,,,"""Clearly, what you search for is being used as information; advertisers use online customer data to target their marketing and increase its effectiveness.""",1
"""Despite the increase in state space from the use of ‚úconverse‚ù functions, we show that the computational burden of the algorithm does not increase.""",,,,,,,"""Despite the increase in state space from the use of ‚úconverse‚ù functions, we show that the computational burden of the algorithm does not increase.""",1
"""The dramatic increase in the arrivals of potential detainees since 2003 suggests that approximately 50,000 beds are currently required, although the estimation of future arrival rates is very difficult due to uncertainties about the future direction of U.S. immigration policy.""",,,,,,,"""The dramatic increase in the arrivals of potential detainees since 2003 suggests that approximately 50,000 beds are currently required, although the estimation of future arrival rates is very difficult due to uncertainties about the future direction of U.S. immigration policy.""",1
"""We investigate two hypotheses regarding stimulus-based causes of preference uncertainty.""",,,,,,,"""We investigate two hypotheses regarding stimulus-based causes of preference uncertainty.""",1
"""We find that the adoption of CPOE systems significantly increases patient complexity reported by hospitals, corresponding to an estimate of $1 billion increase in Medicare reimbursements per year.""",,,,,,,"""We find that the adoption of CPOE systems significantly increases patient complexity reported by hospitals, corresponding to an estimate of $1 billion increase in Medicare reimbursements per year.""",1
