"Building on the seminal work of Thomas J. Allen, we contribute to the emerging microlevel theory of knowledge recombination by examining how individual-level characteristics of inventors affect the breadth of their technological recombinations."
{"id": 3657, "sent": "Book Reviews\u2014Shooman, Martin L., Probabilistic Reliability: an Engineering Approach.", "mnsc_paper_id": "mnsc.16.2.B150"}
{"id": 9279, "sent": "This principle requires that the weights on the higher levels of a hierarchy can be determined independently of the weights on the lower levels.", "mnsc_paper_id": "mnsc.36.3.249"}
"When firms randomize between opaque selling and last-minute selling strategies, they are increasingly likely to choose the opaque selling strategy as the probability of high demand increases."
{"id": 20096, "sent": "Consequently, the assistance process affects the level of cooperation and payoffs.", "mnsc_paper_id": "mnsc.2016.2617"}
"Managers increase effort, prompting firms to reallocate them to new ventures, where the marginal product of effort is highest."
"This is a survey paper on the application of control variables to increase the efficiency of discrete event simulations."
{"id": 2622, "sent": "606 pp.", "mnsc_paper_id": "mnsc.12.2.C13"}
{"id": 10232, "sent": "A two-unit cold standby system with Markovian degrading units and one repair facility is considered.", "mnsc_paper_id": "mnsc.40.3.418"}
"On the other hand, long production runs increase the average makespan (time to completion) of coils."
{"id": 14890, "sent": "Also examined is the impact of the Internet on entertainment activities so as to help cleanse the Internet penetration coefficient of that impact.", "mnsc_paper_id": "mnsc.1070.0833"}
{"id": 20460, "sent": "We find that there are positive spillovers (caused by positive market reactions) and negative spillovers (caused by negative market reactions) that are driven by the market reactions of event firms.", "mnsc_paper_id": "mnsc.2016.2596"}
"The exact results show surprisingly simple structures, which shed light on how system parameters affect the performance."
"Two independent empirical validations using a total of 34 social media campaigns on two different large online social networks show that the proposed seeding strategy can substantially increase a campaign’s reach."
"This extension of the author's earlier work is motivated by the observation that real production systems are usually subject to influences which make for increased stability by tending, as the amount of work-in-process grows, to reduce the rate at which new work is injected or to increase the rate at which processing takes place."
"Telecommunications technology developments uniformly increase content providers' profit."
"For example, when the environment causes a correlation between observed sample sizes (e.g., number of past purchases, projects, observations) and latent underlying parameters (e.g., the likelihood of favorable outcomes), the maximum statistic is a better metric than the mean."
{"id": 13337, "sent": "Based on a large-scale numerical analysis, we find that more frequent new-product introductions are optimal under faster clockspeed conditions.", "mnsc_paper_id": "mnsc.1030.0172"}
{"id": 19151, "sent": "Interactions between the producer and other team members have a greater effect on revenues than other repeated pairs for which consumers might have preferences.", "mnsc_paper_id": "mnsc.2014.2139"}
"Because information-related illiquidity can arise when uncertainty is high, we focus our analysis on evidence that noninformational liquidity affects price informativeness."
{"id": 9067, "sent": "This paper reports an experiment on the generation of macrodynamics from microstructure in a common managerial context.", "mnsc_paper_id": "mnsc.35.3.321"}
"This decrease stems primarily from the reduction in effort that outweighs any benefit from strengthening the salespeoples’ bargaining position."
"We develop a model to analyze how board governance affects firms’ financial reporting choices and managers’ incentives to manipulate accounting reports."
{"id": 5046, "sent": "It is shown that the use of the third-type asymptotic distribution of the largest values as an approximation to the exact distribution provides for an expression for the expected value and the mode of the largest earthquake magnitude in the next n years.", "mnsc_paper_id": "mnsc.21.4.418"}
{"id": 9781, "sent": "The results suggested that responses are influenced by the characteristics of the actions that evoked them.", "mnsc_paper_id": "mnsc.38.3.439"}
"The optimizations show that rescheduling programs can, on the average, substantially increase a network's audience size (11.6%) and advertising revenue ($61 million per year)."
{"id": 2375, "sent": "This paper describes a variant of the Simplex algorithm, applicable to matrices containing blocks of elements along and just below the diagonal.", "mnsc_paper_id": "mnsc.11.3.420"}
{"id": 16586, "sent": "Beyond the Glass Ceiling: Does Gender Matter? (", "mnsc_paper_id": "mnsc.1120.1514"}
{"id": 16412, "sent": "In 2007, 55 million people made 376 million trips to casinos in the United States alone, despite their obviously negative expected payoff.", "mnsc_paper_id": "mnsc.1110.1504"}
"H4 The relative advantage of causal over naïve methods increases as the amount of change in the environment increases."
"First, change in forward-looking risk premiums is negatively related to the S&P 500 holding period return, reflecting that an increase in discount rate reduces current stock prices."
{"id": 9482, "sent": "Search theory is used to model the information processing activities and to study the value of unit memory, communication between units and the coordination of two or more units.", "mnsc_paper_id": "mnsc.37.2.216"}
{"id": 20655, "sent": "We further use model simulation to show how differences in growth patterns across markets may be driven by local characteristics, and we decompose their relative impact on the demand and supply sides.", "mnsc_paper_id": "mnsc.2016.2666"}
"This effect is further amplified when the analogous distance between the markets increases, i.e., when searching in far versus near analogous markets."
"We analyze how market design choices about counterparty information and costs related to the “plumbing” (i.e., clearing, settlement, and custody) of securities markets affect market quality and welfare."
"The growing importance of DSS for both strategy evaluation and end user computing increases the need to provide research-based guidance for the design of user interface aids."
"Our results provide field-based evidence that PFP and participative goal setting affect the level and accuracy of goals, effects that are associated with both information exchange and with managers' incentives to influence goals."
{"id": 19343, "sent": "Given the recent concern on \u201cbig governments\u201d and rising budget deficits in the United States and European nations, there has been a fundamental economic debate on the proper boundary and role of governments in a society.", "mnsc_paper_id": "mnsc.2015.2164"}
{"id": 22635, "sent": "This paper examines the theoretical properties of full-cost transfer prices in multidivisional firms.", "mnsc_paper_id": "mnsc.2019.3477"}
{"id": 11007, "sent": "We tested the proposed approach with 40 test problems involving between 1,728 and 8,640 shift variations, and five demand patterns.", "mnsc_paper_id": "mnsc.42.4.591"}
"Disagreement about stock valuation, combined with short-sales constraints, can increase asset prices."
"We then develop the insight that in the presence of high-probability cycles care should be taken in allocating the new transition probabilities so that the variance accumulated over these cycles does not increase without bounds."
"We show that at any given time, the optimal price decreases with inventory."
{"id": 5147, "sent": "The closed-loop Nash, strategy is suggested as a possible solution concept for this problem and it is shown that if the cost functions are quadratic, then the system together with its closed-loop Nash strategies will have the same structure as the well-known Richardson's model of arms race.", "mnsc_paper_id": "mnsc.22.1.96"}
{"id": 16173, "sent": "Prior firm experience, firm capabilities, and the industry environment are known to be important determinants of new-venture performance.", "mnsc_paper_id": "mnsc.1100.1294"}
{"id": 22124, "sent": "Recent studies document the increasing effectiveness of shareholder voting as a monitoring mechanism.", "mnsc_paper_id": "mnsc.2018.3260"}
"In contrast, for firms with specialized complementary assets, increases in patent effectiveness increase patenting propensity but reduce the propensity to license."
"We achieve this by formulating a structural model that uses a Bayesian learning framework to capture how callers’ past waiting times and abandonment/redialing decisions affect their current abandonment and redialing behavior and use our data to impute the callers’ underlying primitives such as their rewards for service, waiting costs, and redialing costs."
"Results from six laboratory studies and a field experiment demonstrate that exposure to messages that praise customers for good deeds can increase subsequent self-interested and self-indulgent behaviors more than messages that publicize a company’s good deeds or thank consumers for their patronage."
"In addition by examining the dynamics of the system a new method, referred to as the R-method, is derived for solving linear programmes, although it is not demonstrated that this has any computational advantages over the standard simplex method, except that degeneracy causes no problems."
"Recognition of the causes of this lag helps to explain the current state of management science in marketing and will contribute to an understanding of future prospects and opportunities."
"Using data on opposition to patents at the European Patent Office we show that opposition decreases in fields in which many others profit from patent revocations."
{"id": 9377, "sent": "This paper also suggests counter-strategies for responding to government restrictions on firms' entry.", "mnsc_paper_id": "mnsc.36.4.476"}
"The analysis shows that competition can breed a demand for produce-to-stock, just as other economic phenomena such as economies of scale, uncertainty, or seasonality can induce make-to-stock, and that delivery-time competition increases the buyer's welfare while decreasing the producer's welfare."
"Even though the profit of either firm decreases as customers become more strategic, the low-quality firm suffers substantially more than the high-quality firm."
{"id": 9506, "sent": "We provide bounds on the performance of the approximations for single and multiple machine stations.", "mnsc_paper_id": "mnsc.37.3.282"}
{"id": 1579, "sent": "New York: McGraw-Hill Book Company, Inc., 1961, $11.00, 627 pp\u2014reviewed by Murray A. Geisler;\u2014Newman, William H. and Summer, Charles E. Jr., The process of management-concepts, behavior, and practice.", "mnsc_paper_id": "mnsc.8.4.528"}
{"id": 4906, "sent": "Failures in the implementation of management information systems (\u201cMIS's\u201d) can be attributed in part to a lack of managerial \u201cinvolvement\u201d and \u201cappreciation.\u201d", "mnsc_paper_id": "mnsc.21.2.178"}
{"id": 21671, "sent": "This paper was accepted by Tyler Shumway, finance.", "mnsc_paper_id": "mnsc.2018.3205"}
{"id": 988, "sent": "Management of the sponsoring firm had planned to make a policy decision based on differences between averages of overlapping distributions.", "mnsc_paper_id": "mnsc.6.3.295"}
"Organ exchanges are expected to increase the utilization of living donors and to alleviate the critical shortage of organs for transplantation."
{"id": 8342, "sent": "The Herstein\u2013Milnor independence axiom is a necessary condition for recursion analysis of decisions in extensive (=tree) form.", "mnsc_paper_id": "mnsc.32.3.382"}
{"id": 18113, "sent": "The incentive to do this is strongly affected by the complexity of the news product and the intensity of competition between news providers.", "mnsc_paper_id": "mnsc.2013.1742"}
"In this paper, we take a broader approach to the issue, combining a “productivity” and an “adoption” approach, while including a search for contextual variables in the firm’s strategy that affects complementarity."
"Second, consistent with decision theory, we predict that marketing decisions become more important with increases in the instability of the marketing environment (i.e., predictability), the profit impact of marketing decisions (i.e., opportunity profit), and the loss from marketing mistakes (i.e., potential loss).Third, we construct empirical measures of our theoretical constructs with data from 592 firms."
"Yet little empirical research has examined how reference groups affect the product line decisions of firms."
"The dramatic increase in the arrivals of potential detainees since 2003 suggests that approximately 50,000 beds are currently required, although the estimation of future arrival rates is very difficult due to uncertainties about the future direction of U.S. immigration policy."
"First, we find that both accommodating line-sitting and selling priority can bring in extra revenue for the service provider, although by different means—selling priority increases revenue mainly by allowing the service provider to practice price discrimination that extracts more customer surplus, whereas line-sitting does so through demand expansion, attracting customers who would not otherwise join."
{"id": 16798, "sent": "Nonetheless, in contrast to the extant literature, we find that the investor will \u201cgive up\u201d and sell at a loss when the asset has a sufficiently low Sharpe ratio.", "mnsc_paper_id": "mnsc.1110.1468"}
{"id": 19463, "sent": "We develop a model of regard for others and in-group favoritism that predicts interaction effects between organizational values and personal values in contest games.", "mnsc_paper_id": "mnsc.2015.2331"}
"Using a random sample of manufacturing firms across the United States, we find that this interaction does indeed affect the adoption of MRP, though it does not seem to affect MRP infusion."
{"id": 5423, "sent": "A duality theorem for nonlinear programming.", "mnsc_paper_id": "mnsc.23.1.32"}
"We identify one channel through which management can affect voting outcomes: increasing the turnout of (typically management-friendly) retail shareholders."
{"id": 253, "sent": "The purpose of this paper is to illustrate an application of linear programming to the problem of allocation of aircraft to routes in order to maximize expected profits when there is uncertain customer demand.", "mnsc_paper_id": "mnsc.3.1.45"}
"In many services, the quality or value provided by the service increases with the time the service provider spends with the customer."
{"id": 14934, "sent": "The auditing policy acts as a deterrence device, and we explain why it requires the commitment of the insurer and how it should affect the incentives of SIU staffs.", "mnsc_paper_id": "mnsc.1080.0905"}
"The key prediction of this behavioral model is that channel efficiency decreases with loss aversion for sufficiently Nash-rational retailers."
{"id": 2162, "sent": "Categories for describing and analyzing the assigned mission of an R and D lab are presented.", "mnsc_paper_id": "mnsc.10.4.618"}
{"id": 16897, "sent": "In other queues, however, this behavior is considered unacceptable and is aggressively banned.", "mnsc_paper_id": "mnsc.1110.1438"}
{"id": 18234, "sent": "We address this question by studying the impact of Craigslist, a website providing classified-advertising services, on local U.S. newspapers.", "mnsc_paper_id": "mnsc.2013.1785"}
"Comparisons of guidance months to nonguidance months show that guidance issuance affects the magnitude and not just the daily distribution of negative returns."
{"id": 15469, "sent": "Because understanding charitable motives has important implications for auction design and charities' fundraising strategies, this study investigates bidders' specific types of charitable motives and the strength of these motives.", "mnsc_paper_id": "mnsc.1090.1120"}
"Both market design and fee structure affect quote aggressiveness and trading volume and its composition."
{"id": 6052, "sent": "A network of queues obtained from simulating this job-shop under a composite dispatching rule is also modeled and interpreted as a first order, multivariate autoregressive process.", "mnsc_paper_id": "mnsc.24.4.456"}
{"id": 84, "sent": "This paper reports some of the findings of a research team that has been developing new methods to enable production executives to make better decisions and to make them more easily than they can with prevailing procedures.", "mnsc_paper_id": "mnsc.2.1.1"}
"Although a combination of large rebates plus sales incentives substantially increases market share, information and sales incentives alone each have zero statistical effect and explain at most a small fraction of the low baseline market share."
{"id": 16420, "sent": "In short, personal experience matters.", "mnsc_paper_id": "mnsc.1110.1504"}
"Supporting these arguments using the empirical setting of Gujarati immigrant entrepreneurs in the lodging industry, we find that the likelihood of survival of an immigrant entrepreneur’s hotel increases when surrounded by higher counts of branded hotels (representing high-resource establishments) owned by individuals from their ethnic group but is unaffected by unbranded motels (representing low-resource establishments) owned by members of their ethnic group or by branded hotels owned by individuals from other ethnic groups."
{"id": 6130, "sent": "However, when insufficient resources exist to allow die construction of enough facilities to serve all demand centers within the alloted time, the location problem is frequently restated in order to locate the budgeted facilities to serve the serviced population.", "mnsc_paper_id": "mnsc.25.1.107"}
"Consistent with prior research the authors find that online customers significantly increase their banking activity, acquire more products, and perform more transactions."
"We study both “preemptive EMA,” in which farms engage in adulteration to decrease the likelihood of producing low-quality output, and “reactive EMA,” in which adulteration is done to increase the perceived quality of the output."
{"id": 10664, "sent": "The application of these results to portfolio insurance is emphasized, and hedging strategies studied by Black and Jones and by Brennan and Schwartz are generalized.", "mnsc_paper_id": "mnsc.41.4.722"}
"Whereas most of these characteristics predict proxy contests in time series, prior to proxy contests, targets also experience poor stock performance, decreases in investments, increases in cash reserves and payouts to shareholders, and increases in management’s entrenchment."
{"id": 4583, "sent": "The forecasting errors of the best of the Box-Jenkins models that were tested are either approximately equal to or greater than the errors of the corresponding exponentially smoothed models.", "mnsc_paper_id": "mnsc.20.1.22"}
"This paper characterizes optimal pay-performance sensitivities of compensation contracts for managers who have private information about their skills, and those skills affect their outside employment opportunities."
"Fee-upon-sale” types of e-waste regulation cause manufacturers to increase their equilibrium development time and expenditure, and thus the incremental quality for each new product."
{"id": 8561, "sent": "We hope that this model will serve as the basis for a broader use of management science techniques in the study of other politico-economic systems.", "mnsc_paper_id": "mnsc.33.2.270"}
"We also examine how the proximity to a brand’s city of origin, the assortment share of a store’s private label, the extent of retail competition, and the demographics of the store’s neighborhood affect the purchase share’s sensitivity to the point-of-sale marketing mix, revealing several subtle effects."
{"id": 12207, "sent": "An innovative business practice attributed to the information technology (IT) industry is the aggressive use of employee stock options to compensate executives and other employees.", "mnsc_paper_id": "mnsc.46.4.530.12055"}
{"id": 5821, "sent": "Management Sci.22 (8, April) 918\u2013920] discuss the occurrence of nonlinearities in the application of goal programming and conclude that direct linearization may not be possible when goal constraints are of a fractional nature.", "mnsc_paper_id": "mnsc.24.1.105"}
{"id": 13184, "sent": "The IS organization and strategy research stream focuses the level of analysis on the locus of value of the IS investment instead of on the perceptions of a system or its user.", "mnsc_paper_id": "mnsc.1040.0206"}
"We find that corporate entrepreneurs are more likely to conduct search in new domains following events that cause them to expect future performance to change significantly and lastingly."
{"id": 12422, "sent": "For project leadership it shows why and how management should adapt a more project-specific style.", "mnsc_paper_id": "mnsc.47.3.394.9772"}
"The formulation enables us to rigorously answer economic questions ranging from pricing, revenue sharing, and production levels in a static setting, to market dynamics covering both the causes and effects of changes in industry structure."
{"id": 6925, "sent": "More recently, utility theory has been suggested as an alternative approach.", "mnsc_paper_id": "mnsc.27.4.414"}
"With quotas set over short time horizons, the high-performing salespeople focus mainly on low-ticket products, resulting in a decrease in both sales volume and the sale of high-ticket products, thus reducing the firm’s profits."
"In contrast, when they are substitutes, an increase in one is associated with a decrease in the other."
"In particular, we show that it is optimal to increase the density of distribution centers (DCs) when the shortage penalty cost increases, and to decrease the density of DCs when a certain unit transportation cost parameter increases."
{"id": 7836, "sent": "A proof of their optimality in estimating the expected value of the response sum or the response difference of a pair of functions of vector arguments with dependent components is presented.", "mnsc_paper_id": "mnsc.31.1.66"}
{"id": 6839, "sent": "An optimal inspection policy is a sequence of inspection times which minimizes the average cost per inspection cycle relative to some cost model.", "mnsc_paper_id": "mnsc.27.3.260"}
"The purpose of this paper is to provide a framework for integrating the various views and analyzing the various factors that affect centralization and decentralization."
"Pay–performance sensitivity, measured by dollar changes in manager wealth over dollar changes in firm value, decreases with proxies for growth option intensity and increases with proxies for growth option exercise."
"The quality of personalized results increases monotonically with the length of a user’s history."
"They first study how path-generation methods (PGMs) affect the structure of the discontinuities and what the effect of discontinuities is on the accuracy of QMC methods."
{"id": 19118, "sent": "In treatments where employers can combine sanctions and rewards, employers rely mainly on rewards, and outcomes closely resemble those of treatments where only rewards are possible.", "mnsc_paper_id": "mnsc.2014.2124"}
"For firms with an ecosystem of complements, a 1% increase in the use of nonpecuniary OSS leads to an increase in value-added productivity of between 0.002% and 0.008%."
{"id": 16116, "sent": "What process, in other words, should organizers of status-based contests impose upon those who covet peer recognition?", "mnsc_paper_id": "mnsc.1100.1281"}
"I argue that the increase in asset return uncertainty during the crisis results in a spread spike, making it more costly for shadow banks to roll over their debt in the short-term debt market."
{"id": 9492, "sent": "failure", "mnsc_paper_id": "mnsc.37.2.249"}
"For example, when the product cost is low and/or there are sufficient expert (more sophisticated) product users, the two types of information are complements, and the seller's best response is to increase the amount of product attribute information conveyed via its marketing communications after the reviews become available."
"After the Berlin Wall fell, migration from East Germany accounted for an abrupt increase in the supply of a key resource—labor—in the West."
"Thus, when food energy intake decreases, the activity pattern of an individual as represented by a queueing system changes: more time is spent at rest; less time is spent in moving activities."
"Strategic decisions to invest in new equipment are critical not only because of the large initial capital costs incurred but even more importantly because they affect future unit production costs, revenues, and the ability of the firm to perform operations that were not possible earlier."
{"id": 6960, "sent": "8 (1979), p. 810) and Robinson (Management Science, Vol.", "mnsc_paper_id": "mnsc.27.4.489"}
"We, however, find that returns increase significantly on days during the fiscal quarter when adverse-selection risk is high and liquidity low."
{"id": 16898, "sent": "In all of these cases, customer exhibit strategies that have not yet been explored in the operations literature: they choose whether or not to cut the line and must also decide whether to accept or reject such intrusions by others.", "mnsc_paper_id": "mnsc.1110.1438"}
"The insight for management: Information sharing policies in auctions affect bidding strategies and procurement prices."
