"Through two experiments conducted in the field and complementary online experiments, we compare how transparency into these internal and external initiatives affects customer perceptions and sales."
{"id": 14896, "sent": "failure", "mnsc_paper_id": "mnsc.1080.0982"}
{"id": 10331, "sent": "Then it introduces a modified Longest Tail Heuristic whose analysis identifies those situations that permit efficient branching.", "mnsc_paper_id": "mnsc.41.1.94"}
"Therefore, large banks, or those with greater reliance on wholesale funding, increase their wholesale funding more."
{"id": 10838, "sent": "Res.", "mnsc_paper_id": "mnsc.42.2.304"}
"An accident that causes little direct harm may have immense consequences if it increases the judged probability and seriousness of future accidents."
{"id": 18199, "sent": "Although firms can benefit from managing service expectations at the beginning of a relationship, we find that varying service in the long run is not optimal.", "mnsc_paper_id": "mnsc.2013.1775"}
"Internet content increases adoption and can be changed more quickly; however, the magnitude of its impact, and therefore its effectiveness as a policy and strategy tool, has until now been unknown."
"It is estimated that on average, a $1 increase in state CIO budgets is associated with a reduction of as much as $3.49 in state overall expenditures."
"For example, greater market instability and market presence increase the value of marketing expertise, while larger organization size, organization instability, and competition decrease its value."
"Using patient mortality as an outcome measure, we find that the quality of a surgeon’s performance at a given hospital improves significantly with increases in his or her recent procedure volume at that hospital but does not significantly improve with increases in his or her volume at other hospitals."
{"id": 23495, "sent": "This leads to a lower fill rate after inventory reoptimization, likely the result of a lower profit margin under BOPS, which turns away store-only customers and hurts the retailer.", "mnsc_paper_id": "mnsc.2021.3964"}
"Effective reporting oversight curtails managers’ ability to manipulate, which increases the benefits of conservative accounting and simultaneously reduces its costs."
"We attribute the effect to increased search friction: travelers’ search intensity increases by 18.3% when market size doubles."
"Two of these processes are used to increase system efficiency."
"Using data on the life histories of all 134 firms founded to exploit MIT-assigned inventions during the 1980-1996 period, the study analyzes how resource endowments affect the likelihood of three critical outcomes: that new ventures attract venture capital financing, experience initial public offerings, and fail."
"Takeover bidders in stock-for-stock mergers have strong incentives to increase their own premerger stock prices to lower their acquisition costs."
{"id": 13417, "sent": "In either equilibrium, the performance of the supply chain is strictly less than first best.", "mnsc_paper_id": "mnsc.1040.0211"}
"Consumer boycotts are triggered by egregious events, but the literature has not distinguished the level of egregiousness from consumers’ preferences or disutility associated with a given level of egregiousness, nor has the literature studied how these two components of egregiousness affect boycott intensity."
{"id": 23188, "sent": "This paper was accepted by Gustavo Manso, finance.", "mnsc_paper_id": "mnsc.2020.3871"}
{"id": 3139, "sent": "All of these results, which convey information about the numerical values of optimal policies, given specific demands and an initial level of inventory, depend only on the shape characteristics of the cost functions.", "mnsc_paper_id": "mnsc.14.3.127"}
{"id": 5115, "sent": "Two methods of solution are presented.", "mnsc_paper_id": "mnsc.22.1.57"}
"However, the presence of third-party-remanufactured products can increase the perceived value of new products by up to 7%."
"After accounting for project scope, implementation horizon and whether delays are anticipated, we find that project delay is primarily influenced by the magnitude of downstream rework and downstream delay: the magnitude of both upstream and downstream rework significantly increases downstream delay, which significantly increases project delay."
{"id": 23702, "sent": "Our results suggest that non-GAAP EPS is higher in quality for investors when disclosed in both the annual earnings announcement and the proxy statement.", "mnsc_paper_id": "mnsc.2020.3928"}
{"id": 15634, "sent": "They find that the current inspection plan being advanced by the U.S. Department of Homeland Security can handle only a small percentage of the total load, and significant congestion delay will result.", "mnsc_paper_id": "mnsc.1100.1300"}
{"id": 11760, "sent": "Industrial lotsizing and scheduling pose very difficult analytical problems.", "mnsc_paper_id": "mnsc.45.2.273"}
"In contrast, we find significant and persistent increases in physical activity for those assigned (oftentimes against their preference) to the same gain-loss incentives."
{"id": 13912, "sent": "The weighted ratings of the five categories together determine use behavior and purchase behavior, after controlling for purchase need, experience with similar sites, and previous purchase on the specific sites.", "mnsc_paper_id": "mnsc.1050.0442"}
"In 2012, the U.S. Food and Drug Administration mandated all manufacturers to report any manufacturing interruption that can potentially cause shortages."
{"id": 17386, "sent": "The authors examine the feedback patterns observed on eBay and other platforms and demonstrate how reciprocity can be managed by changes in the way feedback information flows through the system.", "mnsc_paper_id": "mnsc.2013.1707"}
{"id": 15430, "sent": "We also discuss how to preserve the sample mean vector and sample covariance matrix exactly for any data perturbation method.", "mnsc_paper_id": "mnsc.1090.1104"}
{"id": 20462, "sent": "Moreover, a spillover that is driven by a leading firm within a business group has stronger effects on other firms in the group than a spillover that is driven by a nonleading firm.", "mnsc_paper_id": "mnsc.2016.2596"}
{"id": 14221, "sent": "Furthermore, we create a framework for simultaneously making inventory and transportation decisions by incorporating the transportation costs (or limited truck capacities).", "mnsc_paper_id": "mnsc.1060.0627"}
"This paper investigates how the presence of social learning affects the strategic interaction between a dynamic-pricing monopolist and a forward-looking consumer population, within a simple two-period model."
{"id": 1269, "sent": "A numerical example, a model construction example, and a description of a particular existing computer system are included in order to clarify the mode of operation of the method.", "mnsc_paper_id": "mnsc.7.4.379"}
"Since no standards for technology choice currently exist and user demand is expected to increase, system flexibility is also an important concern."
{"id": 4886, "sent": "A Bayesian approach is then developed for determining the information value of the library's resources.", "mnsc_paper_id": "mnsc.21.2.130"}
"This finding suggests that the interaction between disagreement and underreaction to earnings news affects asset prices."
{"id": 18149, "sent": "This paper was accepted by Uri Gneezy, behavioral economics.", "mnsc_paper_id": "mnsc.2013.1784"}
{"id": 24212, "sent": "Hence, the buyer not only faces a tradeoff between exploration and exploitation but also needs to decide how to explore: by facilitating quality experimentation or by strategically separating seller types.", "mnsc_paper_id": "mnsc.2021.3988"}
"The insight for management: Availability contingency clauses on price guarantees sound like a safeguard for retailers, but, in fact, they reduce prices and increase inventory availability competition, making retailers worse off and consumers better off."
"For example, an additional 10 days of competition from professional sports in 1987 would have resulted in a 4% decrease in both attendance and wagering."
{"id": 24384, "sent": "We provide conditions under which guaranteed VWAP contracts are optimal in this principal-agent problem.", "mnsc_paper_id": "mnsc.2021.4022"}
"Some argue that experience with existing markets causes managers to miss entry opportunities."
"The purpose of this article is to formulate and test a decision model to increase the return on a pool of liquid assets through the use of Treasury bill futures contracts."
"Using unique idea-level data from a large European car parts manufacturer, we show that interplant assignments significantly increase the value of employees’ improvement ideas due to the short-term transfer of production knowledge and long-term employee learning."
{"id": 13271, "sent": "The information in this issue should be of interest both to academics and managers, and represents the current thoughts in an emerging area of marketing and operations interfaces.", "mnsc_paper_id": "mnsc.1030.0171"}
"The EHR module that has been alleged to increase reimbursements is the Computerized Physician Order Entry (CPOE) system, which populates patient charts with default templates and allows physicians to copy and paste data from previous charts of the patient and other patients’ records."
"The continuation region is shown to shift up (down) with increases in the expected level of substitute (complementary) competition making the firm less (more) likely to adopt the innovation."
{"id": 3080, "sent": "Because the line balancing and sequencing procedures consider a wide variety of factors, they are applicable to many types of assembly lines.", "mnsc_paper_id": "mnsc.14.2.B59"}
{"id": 9102, "sent": "The most significant results are that (1) the tightness of the capacity constraint is a good indicator of problem difficulty for problems with setup time; and (2) the algorithm solves larger problems better than smaller problems, although they are more time consuming to solve.", "mnsc_paper_id": "mnsc.35.3.353"}
{"id": 3855, "sent": "An n job, one machine sequencing algorithm for minimizing the number of late jobs.", "mnsc_paper_id": "mnsc.17.1.116"}
{"id": 3297, "sent": "The objective function is formulated in terms of variance and/or expectation.", "mnsc_paper_id": "mnsc.15.1.72"}
{"id": 23281, "sent": "Prior research suggests portfolio entrepreneurs\u2014businesspeople who run more than one firm simultaneously\u2014launch more successful ventures than their single-business counterparts.", "mnsc_paper_id": "mnsc.2020.3929"}
{"id": 12326, "sent": "More recent literature has developed the concept of product architecture as another choice variable that may be one of the important contributors to product complexity.", "mnsc_paper_id": "mnsc.47.1.189.10662"}
{"id": 12517, "sent": "Thus, when intelligent use of already available internal information (order history) suffices, there is no need to invest in interorganizational systems for information sharing.", "mnsc_paper_id": "mnsc.47.4.605.9833"}
"With a data set consisting of automobile sales transaction data from a major U.S. automaker, the authors find a 20% improvement in prediction accuracy over state-of-the-art benchmark models, which can result in a 10% increase in revenues from optimizing the offer set."
"The authors confirm that accrual characteristics cause investors to overvalue stocks."
"Generating Ambiguity in the Laboratory (p. 705)Jack Stecher, Timothy Shields, John DickhautHow does a decision maker's perception of probability and ambiguity affect their decisions?"
"The prevalence of broad front technological strategies, and of divisionalisation, increases sharply with firm size, together with dependence on formal R and D activities."
{"id": 16238, "sent": "Why do theory and practice differ?", "mnsc_paper_id": "mnsc.1110.1347"}
"Combinatorial auctions—in which bidders can bid on combinations of goods—can increase the economic efficiency of a trade when goods have complementarities."
{"id": 9536, "sent": "The Army's goal is to meet these quotas, in a postulated recruiting environment, at minimum total incentive expenditure.", "mnsc_paper_id": "mnsc.37.3.350"}
"Evidence shows that the electronic trading system has more price discovery and that trading automation increases the speed of incorporating information into prices."
{"id": 2783, "sent": "inventory costs is analyzed.", "mnsc_paper_id": "mnsc.13.1.105"}
"Under very general assumptions on the form of the effort function, we show that buy-backs adversely affect supply chain profits, and higher buy-back prices imply lower profits."
{"id": 1301, "sent": "By Austin Grimshaw and John W. Hennessey.", "mnsc_paper_id": "mnsc.7.4.445"}
{"id": 6814, "sent": "This is one of the few examples in which new technology can be used to reduce the manpower needs of a police department.", "mnsc_paper_id": "mnsc.27.2.213"}
{"id": 20904, "sent": "Rank-order relative-performance evaluation, in which pay, promotion, symbolic awards, and educational achievement depend on the rank of individuals in the distribution of performance, is ubiquitous.", "mnsc_paper_id": "mnsc.2017.2907"}
{"id": 5327, "sent": "The model is described by states with the Markovian property and solutions may be derived for moderately sized numbers of operatives.", "mnsc_paper_id": "mnsc.22.3.371"}
{"id": 17809, "sent": "We do so using the event-study methodology.", "mnsc_paper_id": "mnsc.1120.1565"}
"Also, the optimal time to market and capacity increase with the coefficients of innovation and imitation in the adoption population."
{"id": 10752, "sent": "That is, if the initial stock is greater than this critical point, the optimal planned production is zero; otherwise, it is greater than zero.", "mnsc_paper_id": "mnsc.42.1.130"}
{"id": 8417, "sent": "Results show that kanban, when implemented in certain environmental settings, does indeed perform exceptionally well.", "mnsc_paper_id": "mnsc.33.1.39"}
{"id": 10989, "sent": "The estimated truncation point is selected when the MMAE mean estimate is within a small tolerance of the assumed steady-state mean.", "mnsc_paper_id": "mnsc.42.4.559"}
{"id": 2443, "sent": "It is suggested that the O.R. group and individuals that face up to the challenge of defining a program through the implementation phase, securing management's continuing review and participation in defining and supporting the OR&D program, will find that a greater percentage of projects will produce meaningful results.", "mnsc_paper_id": "mnsc.11.4.B48"}
"Furthermore, for “very high” search levels, even the system profit (sum of manufacturer and retailer profits) may decrease upon centralization."
"Greater involvement from customer investors thus increases funding success."
{"id": 13627, "sent": "We investigate it in a laboratory setting using a novel multistage trust game where social gains are achieved if players trust each other in each stage.", "mnsc_paper_id": "mnsc.1040.0350"}
"Additionally, a short-sale prohibition increases market depth."
{"id": 10210, "sent": "The model accounts for variable costs of supply, fixed investment costs, capacity constraints at the regional and local levels, and water quality requirements at the local sites.", "mnsc_paper_id": "mnsc.40.3.353"}
{"id": 13755, "sent": "We identify reliance on basic R&D\u2014the importance of universities and research centers as an information source for the innovation process\u2014as an important contextual variable affecting complementarity between internal and external innovation activities.", "mnsc_paper_id": "mnsc.1050.0470"}
"We study how the joint pricing of these products affects price discovery and the distribution of gains from trade in an asset market."
{"id": 4937, "sent": "as well as more recent additions and (ii) to give computational comparisons of three other solution methods with that of El-Shaieb on his 30-city test data.", "mnsc_paper_id": "mnsc.21.2.230"}
{"id": 7527, "sent": "The discussion of the fundamental p-center and p-median problems in Part I of this paper provides the basis for the work surveyed in Part II.", "mnsc_paper_id": "mnsc.29.4.498"}
"The estimates serve as a basis for projecting the change in electricity prices once carbon emissions become costly; the net effect of such charges is predicted to be a 30% increase in energy prices at the retail level."
{"id": 8193, "sent": "Suggestions for developing a better link between MIS and organizational theory are presented based on the concept of organizational effectiveness.", "mnsc_paper_id": "mnsc.32.2.156"}
"Increases in gasoline prices (by imposition of taxes, for instance) are much more effective in reducing carbon emissions, whereas battery-price-reducing policy interventions are more effective for reducing oil dependence."
{"id": 7799, "sent": "The analysis requires information in the form of available data and expert judgments concerning factors such as ambient CO level, human exposure to CO, physiological responses, and dose-response relationships.", "mnsc_paper_id": "mnsc.30.4.518"}
{"id": 124, "sent": "For business became interested in the electronic computer when it was pointed out that the machine can effect great savings in the processing of data.", "mnsc_paper_id": "mnsc.2.2.107"}
"Fighting City Hall: Entry Deterrence and Technology Upgrades in Cable TV Markets (p. 461)Robert C. SeamansHow does government bailout of automotive and financial companies affect competition?"
"This paper examines how liquidity and investors’ heterogeneous liquidity preferences interact to affect asset pricing."
{"id": 23966, "sent": "Finally, we illustrate our proposed design on metastatic breast cancer.", "mnsc_paper_id": "mnsc.2021.4096"}
{"id": 7021, "sent": "Many of the distinctions that appear important in conventional game theory (two-person versus n-person, zero-sum versus variable sum) appear unimportant in the subjective formulation.", "mnsc_paper_id": "mnsc.28.2.113"}
{"id": 2827, "sent": "He has less need for coordinators and expediters since he has the information needed to make rational decisions on sequencing the work.", "mnsc_paper_id": "mnsc.13.2.B29"}
{"id": 18516, "sent": "For example, observing an additional person in the queue or an additional arrival to the queue leads to an increase in abandonment probability equivalent to a 25-minute or 5-minute increase in wait time, respectively.", "mnsc_paper_id": "mnsc.2014.2058"}
{"id": 2767, "sent": "Qualitative and quantitative comparisons with existing suboptimal algorithms are presented.", "mnsc_paper_id": "mnsc.13.1.42"}
{"id": 9042, "sent": "If investors' preferences are represented by multi-attributed utility functions and returns on different investments and other relevant factors have a joint normal distribution, we show that optimal portfolios can be characterized by a matrix measure of risk aversion.", "mnsc_paper_id": "mnsc.35.3.259"}
"We study how the menu of contracts presented to a decision maker—including contracts she may be precluded from choosing—affects her choice of remunerative but risky actions relative to lower paying, less risky alternatives."
"In contrast to standard portfolio choice models, changes in the investment opportunity set in one regime can affect the optimal trading strategy in another regime even in the absence of transaction costs."
"A paradox in organizational research on judgment and decision making is that although the law-of-effect in adaptive learning suggests that people’s tendency to take a decision decreases after the decision receives negative consequences, people often exhibit an opposite action pattern of escalation of commitment."
{"id": 21395, "sent": "This paper introduces a measure of the degree of decreasing impatience, the DI-index.", "mnsc_paper_id": "mnsc.2017.3015"}
"We contribute to the literature on corporate decision making by showing how state income taxation affects a real corporate decision that has significant economic consequences for the company and the state."
"Similarly, we hypothesize that aggregate performance affects unemployment most when both firm-level dispersion is high and aggregate performance is low, based on the sectoral shift theory."
"The average error with increases in variance of the leadtime distribution."
"Although orginally developed to allocate budget increases, the model may be used in allocating budget cuts as well; this form of the model is also presented."
{"id": 77, "sent": "These remarks are concerned with the policies of the journal of the Institute.", "mnsc_paper_id": "mnsc.1.2.187"}
{"id": 22382, "sent": "General hospitals across the world are becoming larger (i.e., admitting more patients each year) and more complex (i.e., offering a wider range of services to patients with more diverse care needs).", "mnsc_paper_id": "mnsc.2019.3572"}
{"id": 22752, "sent": "We show that, once the issue of encouraging effective collaboration is put center stage, many standard intuitions of the learning race view and alliance portfolio literature are overturned or qualified.", "mnsc_paper_id": "mnsc.2020.3614"}
{"id": 7467, "sent": "The potential of options in forming portfolio return distributions that are more consistent with investor preferences has been well developed, but determining the actual effect of options on portfolio returns remains a complex and unsolved problem.", "mnsc_paper_id": "mnsc.29.4.419"}
{"id": 10749, "sent": "Many production environments are likely to be subject to both types of uncertainties.", "mnsc_paper_id": "mnsc.42.1.130"}
"As new products are introduced (and disposed of) less frequently, the quantity of e-waste decreases and, even excluding the environmental benefits, social welfare may increase."
"In particular, the variance of orders may be larger than that of sales, and the distortion tends to increase as one moves upstream—a phenomenon termed “bullwhip effect.”"
"By incorporating an endogenous informed trading into an optimal incentive contracting model, we analytically show that, apart from reducing incentives, a greater risk increases the level of information-based trading, which consequently enhances executive incentives and offsets the negative risk–incentive relation."
"Managers should be aware of and actively seek out such incentives, and they should communicate clearly that such destructive behaviors are not tolerable to derive the desired effects of merit-based pay increases."
"Effect of Information Feedback on Bidder Behavior in Continuous Combinatorial Auctions (p. 811)Gediminas Adomavicius, Shawn P. Curley, Alok Gupta, Pallab SanyalRecent theoretical advances have shown that combinatorial auctions—in which bidders can bid on combinations of goods—can increase the economic efficiency of a trade when goods have complementarities."
"When global economic growth at the end of the year is low, investors expect a worsening of the global business cycle and increase their required returns."
{"id": 13190, "sent": "Using probabilistic models, we characterize search behavior at the individual level in terms of (1) depth of search, (2) dynamics of search, and (3) activity of search.", "mnsc_paper_id": "mnsc.1040.0194"}
{"id": 7594, "sent": "failure", "mnsc_paper_id": "mnsc.30.1.133"}
"Merger-induced bank branch closings lead to an increase in marketplace loan requests and loan acceptance rates, particularly for debt consolidation loans to lower-risk consumers."
"The ability to estimate cost increases due to forgetting would be useful for economic lot size determinations, bidding on repeat orders, estimating the cost of strikes, and so on."
{"id": 11098, "sent": "Some extensions of the discrete lotsizing and scheduling problem.", "mnsc_paper_id": "mnsc.43.1.122"}
{"id": 19270, "sent": "The direct-mail budget is limited, but better-designed mailings can improve success rates without increasing costs.", "mnsc_paper_id": "mnsc.2015.2149"}
"Recently, there has been a dramatic increase in technology transfer through licensing as universities attempt to appropriate the returns from faculty research."
{"id": 20712, "sent": "We also find that the decrease in e-book sales is greater for books with less prerelease buzz.", "mnsc_paper_id": "mnsc.2017.2940"}
"Gender, Competition, and Managerial Decisions (p. 114)Curtis R. PriceHow does a manager's gender affect the choice of compensation plans for employees?"
{"id": 1731, "sent": "For a project that consists of numerous jobs subject to technological ordering restrictions the polygon representing project cost versus completion time is to be determined when the normal and crash completion times are known for each job and the cost of doing the job varies linearly between these times.", "mnsc_paper_id": "mnsc.9.3.394"}
{"id": 18739, "sent": "This paper was accepted by Yossi Aviv, operations management.", "mnsc_paper_id": "mnsc.2013.1888"}
{"id": 13111, "sent": "First, we hope that it will be useful to doctoral students and researchers interested in understanding what questions have been addressed in Management Science in the area of innovation.", "mnsc_paper_id": "mnsc.1040.0204"}
"Consequently, monetary tightening increases both the reliance on and the concentration of wholesale funding within the banking sector."
"I provide strong evidence that the distribution of export increase is driven by a reduction in export entry cost."
"This paper explores how government restrictions designed to prevent selective advertising affect the types of information to which consumers are exposed."
{"id": 21592, "sent": "In particular, we exploit an exogenous shock to market size caused by a one-time migration of listings from other platforms, which gives rise to a quasiexperimental design.", "mnsc_paper_id": "mnsc.2018.3223"}
