,,,,,,,Text,Contains_Relation
"""It is an inventory problem in which the inventory level can either decrease or increase, and the decision maker is allowed to change the inventory level in any direction at the beginning of each period.""",,,,,,,"""It is an inventory problem in which the inventory level can either decrease or increase, and the decision maker is allowed to change the inventory level in any direction at the beginning of each period.""",1
"""Even though the expected value of cost information strictly decreases with competition, the optimal price for industry-specific cost information set by an information vendor increases with competition when the firms‚ô products are sufficiently substitutable.""",,,,,,,"""Even though the expected value of cost information strictly decreases with competition, the optimal price for industry-specific cost information set by an information vendor increases with competition when the firms‚ô products are sufficiently substitutable.""",1
"""A linear model is presented to aid in developing answers to such questions as the following: (1) What effect will any given demand forecast have on capacity plans, (2) what will be the effect of an expected change in ownership costs, (3) if prices for leased capacity increase by some given amount, how will plans and costs be affected, (4) what is the sensitivity of decisions and costs to forecast error?""",,,,,,,"""A linear model is presented to aid in developing answers to such questions as the following: (1) What effect will any given demand forecast have on capacity plans, (2) what will be the effect of an expected change in ownership costs, (3) if prices for leased capacity increase by some given amount, how will plans and costs be affected, (4) what is the sensitivity of decisions and costs to forecast error?""",1
"""We develop and estimate a model for labor productivity and firms' decision to reorganize workplaces that allows workplace reorganization to affect any parameter of the labor productivity equation.""",,,,,,,"""We develop and estimate a model for labor productivity and firms' decision to reorganize workplaces that allows workplace reorganization to affect any parameter of the labor productivity equation.""",1
"""Further, as the threat of competition increases, the OEM is more likely to completely utilize all available cores, offering the remanufactured products at a lower price.""",,,,,,,"""Further, as the threat of competition increases, the OEM is more likely to completely utilize all available cores, offering the remanufactured products at a lower price.""",1
"""However, it is unclear how volume changes in one service affect the costs of the other services in the same hospital.""",,,,,,,"""However, it is unclear how volume changes in one service affect the costs of the other services in the same hospital.""",1
"""This paper extends this research by considering how loyalty affects firms‚ô decisions to facilitate search for nonloyal consumers.""",,,,,,,"""This paper extends this research by considering how loyalty affects firms‚ô decisions to facilitate search for nonloyal consumers.""",1
"""If both quantities are low, then the optimal portfolio consists of a mix of familiar and unfamiliar assets; moreover, an increase in correlation between assets causes an investor to increase concentration in familiar assets (flight to familiarity).""",,,,,,,"""If both quantities are low, then the optimal portfolio consists of a mix of familiar and unfamiliar assets; moreover, an increase in correlation between assets causes an investor to increase concentration in familiar assets (flight to familiarity).""",1
"""These two runs interact and reinforce each other, with compound feedback loops that drastically increase the probability of the collapse of the bank.""",,,,,,,"""These two runs interact and reinforce each other, with compound feedback loops that drastically increase the probability of the collapse of the bank.""",1
"""Beyond the first year, exposure to higher peer ability during the orientation week negatively affects selection into the college‚ôs most popular major (business administration) and final grade point average.""",,,,,,,"""Beyond the first year, exposure to higher peer ability during the orientation week negatively affects selection into the college‚ôs most popular major (business administration) and final grade point average.""",1
"""Building on the seminal work of Thomas J. Allen, we contribute to the emerging microlevel theory of knowledge recombination by examining how individual-level characteristics of inventors affect the breadth of their technological recombinations.""",,,,,,,"""Building on the seminal work of Thomas J. Allen, we contribute to the emerging microlevel theory of knowledge recombination by examining how individual-level characteristics of inventors affect the breadth of their technological recombinations.""",1
"""Interestingly, increasing the promotional frequency (while reducing its depth to maintain the mean and variance of prices across all stores) can increase loyalty to the household‚ôs preferred store.""",,,,,,,"""Interestingly, increasing the promotional frequency (while reducing its depth to maintain the mean and variance of prices across all stores) can increase loyalty to the household‚ôs preferred store.""",1
"""We investigate if and how monetary incentives and expectations of social approval or disapproval from the public, and their interactions, affect an employee‚ôs decision to blow the whistle when the social damage from the reported misbehavior is more or less salient.""",,,,,,,"""We investigate if and how monetary incentives and expectations of social approval or disapproval from the public, and their interactions, affect an employee‚ôs decision to blow the whistle when the social damage from the reported misbehavior is more or less salient.""",1
"""My findings suggest that resource diversion induced by increased government spending is a channel through which government spending may affect corporate innovation.""",,,,,,,"""My findings suggest that resource diversion induced by increased government spending is a channel through which government spending may affect corporate innovation.""",1
"""Our results indicate that financial distress risk affects compensation through two channels.""",,,,,,,"""Our results indicate that financial distress risk affects compensation through two channels.""",1
"""We therefore apply the Kernel density-estimation technique and demonstrate that for firms with organizational change, the entire labor productivity distribution shifts significantly out to the right if workplace reorganization takes place, indicating that workplace reorganization induces an increase in labor productivity that is attributable to complementarities between the various input factors and workplace reorganization.""",,,,,,,"""We therefore apply the Kernel density-estimation technique and demonstrate that for firms with organizational change, the entire labor productivity distribution shifts significantly out to the right if workplace reorganization takes place, indicating that workplace reorganization induces an increase in labor productivity that is attributable to complementarities between the various input factors and workplace reorganization.""",1
"""The production smoothing problem with known demands that are assumed to increase with time is treated.""",,,,,,,"""The production smoothing problem with known demands that are assumed to increase with time is treated.""",1
"""Our finding suggests that a 10% increase in visit length would decrease the likelihood of readmission following a home health visit by 6%.""",,,,,,,"""Our finding suggests that a 10% increase in visit length would decrease the likelihood of readmission following a home health visit by 6%.""",1
"""Comparisons of guidance months to nonguidance months show that guidance issuance affects the magnitude and not just the daily distribution of negative returns.""",,,,,,,"""Comparisons of guidance months to nonguidance months show that guidance issuance affects the magnitude and not just the daily distribution of negative returns.""",1
"""The paper also discusses the causes of the bullwhip effect, a phenomenon in which variation in demand produces larger variations in upstream orders and inventory.""",,,,,,,"""The paper also discusses the causes of the bullwhip effect, a phenomenon in which variation in demand produces larger variations in upstream orders and inventory.""",1
"""In addition, team incentives may lead to more coworker support or to higher peer pressure and thereby, can affect the team‚ôs social cohesion.""",,,,,,,"""In addition, team incentives may lead to more coworker support or to higher peer pressure and thereby, can affect the team‚ôs social cohesion.""",1
"""Clearly, inventory could increase sales: expanding inventory creates more choice (options, colors, etc.)""",,,,,,,"""Clearly, inventory could increase sales: expanding inventory creates more choice (options, colors, etc.)""",1
"""Fee-upon-sale‚ù types of e-waste regulation cause manufacturers to increase their equilibrium development time and expenditure, and thus the incremental quality for each new product.""",,,,,,,"""Fee-upon-sale‚ù types of e-waste regulation cause manufacturers to increase their equilibrium development time and expenditure, and thus the incremental quality for each new product.""",1
"""Firms in a vertical relationship are likely to affect each other‚ôs productivity.""",,,,,,,"""Firms in a vertical relationship are likely to affect each other‚ôs productivity.""",1
"""Numerical examples demonstrate that the procedures increase forecast accuracy while reducing the costs associated with frequent forecast updates.""",,,,,,,"""Numerical examples demonstrate that the procedures increase forecast accuracy while reducing the costs associated with frequent forecast updates.""",1
"""Specifically, the total number of competitors affected by an action and the importance to these competitors of the markets under attack by the action increase the number of competitive responses.""",,,,,,,"""Specifically, the total number of competitors affected by an action and the importance to these competitors of the markets under attack by the action increase the number of competitive responses.""",1
"""The choice of an information system affects the level of managerial slack that is generated during project implementation.""",,,,,,,"""The choice of an information system affects the level of managerial slack that is generated during project implementation.""",1
"""Further, incumbents increase the degree of active management.""",,,,,,,"""Further, incumbents increase the degree of active management.""",1
"""We infer that managers chose to enter these markets to obtain this increase in value.""",,,,,,,"""We infer that managers chose to enter these markets to obtain this increase in value.""",1
"""We investigate whether the gender composition of teams affects their economic performance.""",,,,,,,"""We investigate whether the gender composition of teams affects their economic performance.""",1
"""In these circumstances the basic linear programming technique is insufficient, and a model has been developed as a multi-item newsboy problem in which a number of linear resource constraints affect the decision variables.""",,,,,,,"""In these circumstances the basic linear programming technique is insufficient, and a model has been developed as a multi-item newsboy problem in which a number of linear resource constraints affect the decision variables.""",1
"""Two random inputs cause two converging inter-related waiting lines to be formed‚îone of buses and one of passengers.""",,,,,,,"""Two random inputs cause two converging inter-related waiting lines to be formed‚îone of buses and one of passengers.""",1
"""We find that public research is critical to industrial R&D in a small number of industries and importantly affects industrial R&D across much of the manufacturing sector.""",,,,,,,"""We find that public research is critical to industrial R&D in a small number of industries and importantly affects industrial R&D across much of the manufacturing sector.""",1
"""Rather, when competition among resource investors passes a certain threshold intensity, miscoordination among investors increases to the point that sellers' expected profits decline.""",,,,,,,"""Rather, when competition among resource investors passes a certain threshold intensity, miscoordination among investors increases to the point that sellers' expected profits decline.""",1
"""The authors confirm that accrual characteristics cause investors to overvalue stocks.""",,,,,,,"""The authors confirm that accrual characteristics cause investors to overvalue stocks.""",1
"""In fact, even improvements to out-of-assortment products can increase the profits of the retailer and certain in-assortment manufacturers.""",,,,,,,"""In fact, even improvements to out-of-assortment products can increase the profits of the retailer and certain in-assortment manufacturers.""",1
"""Another finding is that when we have a positive change in the factors that increase sampling productivity, steady-state goodwill stock and sales will increase, but equilibrium sampling can either increase or decrease.""",,,,,,,"""Another finding is that when we have a positive change in the factors that increase sampling productivity, steady-state goodwill stock and sales will increase, but equilibrium sampling can either increase or decrease.""",1
"""We find that rival product announcements decrease a firm's financial market value, and that rival filed trademarks increase it.""",,,,,,,"""We find that rival product announcements decrease a firm's financial market value, and that rival filed trademarks increase it.""",1
"""Incorporation of marketing strategy in production planning can reduce overall costs and significantly increase profits.""",,,,,,,"""Incorporation of marketing strategy in production planning can reduce overall costs and significantly increase profits.""",1
"""In the case of carry-over, we establish the general result and show that capacity and inventory are economic substitutes: The target intervals decrease in the initial stock level and the optimal unconstrained base stock level decreases in the capacity level.""",,,,,,,"""In the case of carry-over, we establish the general result and show that capacity and inventory are economic substitutes: The target intervals decrease in the initial stock level and the optimal unconstrained base stock level decreases in the capacity level.""",1
"""Using a simple theoretical framework, I argue that public data reduces investment uncertainty, facilitates the discovery of new market opportunities, and increases the relative market share of new entrants relative to incumbents.""",,,,,,,"""Using a simple theoretical framework, I argue that public data reduces investment uncertainty, facilitates the discovery of new market opportunities, and increases the relative market share of new entrants relative to incumbents.""",1
"""The capacity building cost may also increase because of a tighter deadline for building capacity.""",,,,,,,"""The capacity building cost may also increase because of a tighter deadline for building capacity.""",1
"""Also, several classes of countermeasures are examined to determine their ability to increase the time window during which a secret can be held.""",,,,,,,"""Also, several classes of countermeasures are examined to determine their ability to increase the time window during which a secret can be held.""",1
"""The auditing policy acts as a deterrence device, and we explain why it requires the commitment of the insurer and how it should affect the incentives of SIU staffs.""",,,,,,,"""The auditing policy acts as a deterrence device, and we explain why it requires the commitment of the insurer and how it should affect the incentives of SIU staffs.""",1
"""Since no standards for technology choice currently exist and user demand is expected to increase, system flexibility is also an important concern.""",,,,,,,"""Since no standards for technology choice currently exist and user demand is expected to increase, system flexibility is also an important concern.""",1
"""We first study how path-generation methods (PGMs) affect the structure of the discontinuities and what the effect of discontinuities is on the accuracy of QMC methods.""",,,,,,,"""We first study how path-generation methods (PGMs) affect the structure of the discontinuities and what the effect of discontinuities is on the accuracy of QMC methods.""",1
"""Furthermore the need for implementation affects the researcher as well as the manager.""",,,,,,,"""Furthermore the need for implementation affects the researcher as well as the manager.""",1
"""We estimate that our design would yield a 16% decrease in trial costs relative to existing clinical trial designs, while maintaining the same Type I/II error rates.""",,,,,,,"""We estimate that our design would yield a 16% decrease in trial costs relative to existing clinical trial designs, while maintaining the same Type I/II error rates.""",1
"""Stronger policy rule inflation responses or weaker output responses increase real term premia and reduce inflation risk premia.""",,,,,,,"""Stronger policy rule inflation responses or weaker output responses increase real term premia and reduce inflation risk premia.""",1
"""As compared with existing DPS methods, MORE can substantially increase the utility of secure databases without increasing disclosure risk.""",,,,,,,"""As compared with existing DPS methods, MORE can substantially increase the utility of secure databases without increasing disclosure risk.""",1
"""However, the presence of third-party-remanufactured products can increase the perceived value of new products by up to 7%.""",,,,,,,"""However, the presence of third-party-remanufactured products can increase the perceived value of new products by up to 7%.""",1
"""We study the problem faced by a central planner trying to increase the consumption of a good, such as new malaria drugs in Africa.""",,,,,,,"""We study the problem faced by a central planner trying to increase the consumption of a good, such as new malaria drugs in Africa.""",1
"""We find that managers are more likely to choose to deliver a full set of proxy materials when there are contentious items on the ballot for which they need additional voting support; and, indeed, the resulting support increases the likelihood that voting outcomes will align with management recommentations."" ",,,,,,,"""We find that managers are more likely to choose to deliver a full set of proxy materials when there are contentious items on the ballot for which they need additional voting support; and, indeed, the resulting support increases the likelihood that voting outcomes will align with management recommentations."" ",1
"""We find that, on average, these actions reduce both the risk-weighted assets and the nonperforming loans ratios of punished banks, but there is no increase in the level of regulatory capital.""",,,,,,,"""We find that, on average, these actions reduce both the risk-weighted assets and the nonperforming loans ratios of punished banks, but there is no increase in the level of regulatory capital.""",1
"""We find a large and highly significant increase in individuals‚ô bank account balances within the first month of turning 55, which declines by about a third by the end of 12 months.""",,,,,,,"""We find a large and highly significant increase in individuals‚ô bank account balances within the first month of turning 55, which declines by about a third by the end of 12 months.""",1
"""Using a comprehensive sample of publicly traded U.S. firms from 1998 to 2014, we report that status inconsistency increases the likelihood of divestiture that decreases status inconsistency, particularly for high-status firms.""",,,,,,,"""Using a comprehensive sample of publicly traded U.S. firms from 1998 to 2014, we report that status inconsistency increases the likelihood of divestiture that decreases status inconsistency, particularly for high-status firms.""",1
"""We find that node collapses directly affect the performance of the acquirer and indirectly that of other actors, and that the direction of network evolution hinges on the degree to which firms pursue internal versus network synergies through node collapses.""",,,,,,,"""We find that node collapses directly affect the performance of the acquirer and indirectly that of other actors, and that the direction of network evolution hinges on the degree to which firms pursue internal versus network synergies through node collapses.""",1
"""Through employing more than 1,500 workers, we find that our use of CSR increases employee misbehavior‚î24% more employees act detrimentally toward our firm by shirking on their primary job duties when we introduce CSR.""",,,,,,,"""Through employing more than 1,500 workers, we find that our use of CSR increases employee misbehavior‚î24% more employees act detrimentally toward our firm by shirking on their primary job duties when we introduce CSR.""",1
"""We examine how this change in industry structure affects investment in innovation and capacity, and thus profitability.""",,,,,,,"""We examine how this change in industry structure affects investment in innovation and capacity, and thus profitability.""",1
"""Firms are more heterogeneous in their responses, which leads to longer periods of differentiation when the variability of the consumer preferences, the discount rate, or the importance of the repositioning attribute increases.""",,,,,,,"""Firms are more heterogeneous in their responses, which leads to longer periods of differentiation when the variability of the consumer preferences, the discount rate, or the importance of the repositioning attribute increases.""",1
"""Using basically the same model, but focusing on the case of a homogeneous industry, Joglekar and Hamburg (1986) further identify several industry characteristics that increase the degree of suboptimality of investment in basic research, and consequently, the need for government intervention.""",,,,,,,"""Using basically the same model, but focusing on the case of a homogeneous industry, Joglekar and Hamburg (1986) further identify several industry characteristics that increase the degree of suboptimality of investment in basic research, and consequently, the need for government intervention.""",1
"""The simulation results based upon the CEM are consistent with widely held beliefs about the effects of aging on the health care sector, for example, that aggregate expenditures will increase as the population ages.""",,,,,,,"""The simulation results based upon the CEM are consistent with widely held beliefs about the effects of aging on the health care sector, for example, that aggregate expenditures will increase as the population ages.""",1
"""The culture of the national environment in which an organization operates affects the management process through the collective mental programming of its members, its managers, and the management scientists who offer their theories.""",,,,,,,"""The culture of the national environment in which an organization operates affects the management process through the collective mental programming of its members, its managers, and the management scientists who offer their theories.""",1
"""However, if all firms increase the degree of economies of scope then all firms receive lower profits.""",,,,,,,"""However, if all firms increase the degree of economies of scope then all firms receive lower profits.""",1
"""Evidence shows that the electronic trading system has more price discovery and that trading automation increases the speed of incorporating information into prices.""",,,,,,,"""Evidence shows that the electronic trading system has more price discovery and that trading automation increases the speed of incorporating information into prices.""",1
"""Some argue that experience with existing markets causes managers to miss entry opportunities.""",,,,,,,"""Some argue that experience with existing markets causes managers to miss entry opportunities.""",1
"""We find that in theory such hybrid mechanisms increase competition and make buyers better off as long as suppliers are willing to accept noncompetitive contracts.""",,,,,,,"""We find that in theory such hybrid mechanisms increase competition and make buyers better off as long as suppliers are willing to accept noncompetitive contracts.""",1
"""Externalities cause two stable usage equilibria to exist, one with the old technology being the standard and the other with the new technology the standard.""",,,,,,,"""Externalities cause two stable usage equilibria to exist, one with the old technology being the standard and the other with the new technology the standard.""",1
"""Two independent empirical validations using a total of 34 social media campaigns on two different large online social networks show that the proposed seeding strategy can substantially increase a campaign‚ôs reach.""",,,,,,,"""Two independent empirical validations using a total of 34 social media campaigns on two different large online social networks show that the proposed seeding strategy can substantially increase a campaign‚ôs reach.""",1
